Finding Flow: The Psychology of Engagement with Everyday Life (Paperback),/book/show/66321.Finding_Flow,Mihaly Csikszentmihalyi,3.94,4269,1995
Revolution from Within: A Book of Self-Esteem (Paperback),/book/show/335090.Revolution_from_Within,Gloria Steinem,4.11,2069,1991
Today Matters: 12 Daily Practices to Guarantee Tomorrow's Success (Paperback),/book/show/389921.Today_Matters,John C. Maxwell,4.2,5175,2005
Sacred Contracts: Awakening Your Divine Potential (Paperback),/book/show/190115.Sacred_Contracts,Caroline Myss,3.99,15001,2001
20-Something; 20-Everything: A Quarter-Life Woman's Guide to Balance and Direction (Paperback),/book/show/319220.20_Something_20_Everything,Christine Hassler,3.55,1617,2005
This Naked Mind: Control Alcohol: Find Freedom; Discover Happiness & Change Your Life (Kindle Edition),/book/show/27202127-this-naked-mind,Annie Grace,4.3,5380,2015
A Book of Five Rings: The Classic Guide to Strategy (Hardcover),/book/show/867247.A_Book_of_Five_Rings,Miyamoto Musashi,4.05,35273,1645
Permission to Feel: Unlocking the Power of Emotions to Help Our Kids; Ourselves; and Our Society Thrive (Hardcover),/book/show/43782400-permission-to-feel,Marc Brackett,4.24,1818,2019
The Dichotomy of Leadership: Balancing the Challenges of Extreme Ownership to Lead and Win (ebook),/book/show/38714388-the-dichotomy-of-leadership,Jocko Willink,4.39,5131,
Work Rules!: Insights from Inside Google That Will Transform How You Live and Lead (Hardcover),/book/show/22875447-work-rules,Laszlo Bock,4.17,11675,2015
The Blue Zones: Lessons for Living Longer From the People Who've Lived the Longest (Hardcover),/book/show/2213117.The_Blue_Zones,Dan Buettner,4.01,7062,2008
The Decision Book: Fifty Models for Strategic Thinking (Hardcover),/book/show/9793361-the-decision-book,Mikael Krogerus,3.64,4015,2011
Born to Run: A Hidden Tribe; Superathletes; and the Greatest Race the World Has Never Seen (Hardcover),/book/show/6289283-born-to-run,Christopher McDougall,4.29,166920,2009
Steering by Starlight: Find Your Right Life; No Matter What! (Hardcover),/book/show/2185052.Steering_by_Starlight,Martha N. Beck,4.2,1702,2008
I Need Your Love - Is That True?: How to Stop Seeking Love; Approval; and Appreciation and Start Finding Them Instead (Paperback),/book/show/320582.I_Need_Your_Love_Is_That_True_,Byron Katie,4.22,2289,2005
More Than Enough: Claiming Space for Who You Are (No Matter What They Say),/book/show/42729452-more-than-enough,Elaine Welteroth,4.44,5006,2019
The Infinite Game (Hardcover),/book/show/38390751-the-infinite-game,Simon Sinek,4.23,7669,2019
Omgiven av idioter (Paperback),/book/show/22041071-omgiven-av-idioter,Thomas Erikson,3.29,8688,2014
The Nature Fix: Why Nature Makes Us Happier; Healthier; and More Creative (Paperback),/book/show/35187181-the-nature-fix,Florence   Williams,3.97,5965,2017
Never Binge Again: Reprogram Yourself to Think Like a Permanently Thin Person (Kindle Edition),/book/show/27067402-never-binge-again,Glenn Livingston,3.26,4516,2015
The School of Greatness: A Real-World Guide to Living Bigger; Loving Deeper; and Leaving a Legacy (Hardcover),/book/show/23848518-the-school-of-greatness,Lewis Howes,4.04,2266,2015
Radical Self Love: A Guide to Loving Yourself and Living Your Dream (Paperback),/book/show/25559480-radical-self-love,Gala Darling,3.71,1320,2015
Switch On Your Brain: The Key to Peak Happiness; Thinking; and Health (Kindle Edition),/book/show/18922063-switch-on-your-brain,Caroline Leaf,3.93,3951,2007
The Little Book of Mindfulness: 10 Minutes a Day to Less Stress; More Peace (Kindle Edition),/book/show/21111460-the-little-book-of-mindfulness,Patrizia Collard,3.8,2351,2014
The Book of Forgiving: The Fourfold Path for Healing Ourselves and Our World (Hardcover),/book/show/18085474-the-book-of-forgiving,Desmond Tutu,4.2,2931,2013
Sane New World: Taming The Mind (Paperback),/book/show/17984032-sane-new-world,Ruby Wax,3.77,5061,2013
The Mind Map Book: How to Use Radiant Thinking to Maximize Your Brain's Untapped Potential (Paperback),/book/show/80762.The_Mind_Map_Book,Tony Buzan,3.82,2670,1993
Achieve Anything in Just One Year: Be Inspired Daily to Live Your Dreams and Accomplish Your Goals (Paperback),/book/show/7328248-achieve-anything-in-just-one-year,Jason Harvey,3.62,450,2010
How to Win at College: Surprising Secrets for Success from the Country's Top Students (Paperback),/book/show/253197.How_to_Win_at_College,Cal Newport,4.04,2138,2005
Getting from College to Career: 90 Things to Do Before You Join the Real World (Paperback),/book/show/593497.Getting_from_College_to_Career,Lindsey Pollak,3.85,652,2007
The Five Languages of Apology: How to Experience Healing in All Your Relationships (Hardcover),/book/show/107515.The_Five_Languages_of_Apology,Gary Chapman,4.15,2035,2006
Emotions Revealed: Recognizing Faces and Feelings to Improve Communication and Emotional Life (Paperback),/book/show/156462.Emotions_Revealed,Paul Ekman,4.05,6401,2003
Free to Focus: A Total Productivity System to Achieve More by Doing Less (Hardcover),/book/show/40392296-free-to-focus,Michael Hyatt,4.13,1927,
Crushing It!: How Great Entrepreneurs Build Their Business and Influence\xe2\x80\x94and How You Can; Too (Kindle Edition),/book/show/36045512-crushing-it,Gary Vaynerchuk,4.08,6498,2018
Grace; Not Perfection: Embracing Simplicity; Celebrating Joy (Hardcover),/book/show/29492090-grace-not-perfection,Emily Ley,4.01,4913,
Adventures for Your Soul: 21 Ways to Transform Your Habits and Reach Your Full Potential (Paperback),/book/show/23281904-adventures-for-your-soul,Shannon Kaiser,3.87,739,2015
The Anxiety Toolkit: Strategies for Fine-Tuning Your Mind and Moving Past Your Stuck Points (Paperback),/book/show/22521943-the-anxiety-toolkit,Alice Boyes,3.89,755,2015
Facing Codependence: What It Is; Where It Comes from; How It Sabotages Our Lives (Paperback),/book/show/823467.Facing_Codependence,Pia Mellody,4.09,1741,1989
Living Well; Spending Less: 12 Secrets of the Good Life (Paperback),/book/show/21816682-living-well-spending-less,Ruth Soukup,3.68,3467,2014
Scrum: The Art of Doing Twice the Work in Half the Time (Hardcover),/book/show/19288230-scrum,Jeff Sutherland,4.19,14470,2014
An Astronaut's Guide to Life on Earth (Hardcover),/book/show/18170143-an-astronaut-s-guide-to-life-on-earth,Chris Hadfield,4.16,46133,2013
Get the Guy: How to Find; Attract; and Keep Your Ideal Mate (Audio),/book/show/16032581-get-the-guy,Matthew Hussey,4.02,3295,2013
How to Stay Sane (Paperback),/book/show/14059029-how-to-stay-sane,Philippa Perry,3.76,2238,2012
Great by Choice: Uncertainty; Chaos; and Luck\xe2\x80\x94Why Some Thrive Despite Them All (Kindle Edition),/book/show/12675109-great-by-choice,James C. Collins,4.1,16490,2011
The First 90 Days: Critical Success Strategies for New Leaders at All Levels (Hardcover),/book/show/15824358-the-first-90-days,Michael D. Watkins,3.86,17755,2003
Health at Every Size: The Surprising Truth About Your Weight (Paperback),/book/show/4937206-health-at-every-size,Linda Bacon,4.25,3015,2008
The Noticer: Sometimes; All a Person Needs Is a Little Perspective (Hardcover),/book/show/6261270-the-noticer,Andy Andrews,4.18,13577,2009
The Art of Extreme Self-Care: Transform Your Life One Month at a Time (Hardcover),/book/show/1606380.The_Art_of_Extreme_Self_Care,Cheryl Richardson,3.92,1680,2008
The Millionaire Mind (Paperback),/book/show/905092.The_Millionaire_Mind,Thomas J. Stanley,4.2,22124,2006
Simplify Your Life: 100 Ways to Slow Down and Enjoy the Things That Really Matter (Paperback),/book/show/830893.Simplify_Your_Life,Elaine St. James,3.81,1697,1951
How I Raised Myself From Failure to Success in Selling (Paperback),/book/show/109515.How_I_Raised_Myself_From_Failure_to_Success_in_Selling,Frank Bettger,4.27,14156,1947
Too Good to Leave; Too Bad to Stay: A Step-by-Step Guide to Help You Decide Whether to Stay In or Get Out of Your Relationship (Paperback),/book/show/46681.Too_Good_to_Leave_Too_Bad_to_Stay,Mira Kirshenbaum,4.14,2040,1996
This Is Where You Belong: The Art and Science of Loving the Place You Live (Hardcover),/book/show/27209432-this-is-where-you-belong,Melody Warnick,3.67,3056,2016
How to Get Sh*t Done: Why Women Need to Stop Doing Everything so They Can Achieve Anything (Hardcover),/book/show/35297359-how-to-get-sh-t-done,Erin Falconer,3.39,794,
The Power of When: Discover Your Chronotype--and the Best Time to Eat Lunch; Ask for a Raise; Have Sex; Write a Novel; Take Your Meds; and More (Hardcover),/book/show/28449255-the-power-of-when,Michael Breus,3.56,2117,2016
Wishes Fulfilled: Mastering the Art of Manifesting (Hardcover),/book/show/12489036-wishes-fulfilled,Wayne W. Dyer,4.28,4900,2012
Start Where You Are: A Journal for Self-Exploration (Paperback),/book/show/24611808-start-where-you-are,Meera Lee Patel,4.23,1187,2015
Mind Hacking: How to Change Your Mind for Good in 21 Days (Hardcover),/book/show/23972780-mind-hacking,John Hargrave,3.77,1505,2015
I Am That Girl: How to Speak Your Truth; Discover Your Purpose; and #bethatgirl (Paperback),/book/show/18330189-i-am-that-girl,Alexis Jones,3.97,1721,2013
Lovingkindness: The Revolutionary Art of Happiness (Hardcover),/book/show/38215.Lovingkindness,Sharon Salzberg,4.19,5694,1995
The Gaslight Effect: How to Spot and Survive the Hidden Manipulation Others Use to Control Your Life (Paperback),/book/show/36520721-the-gaslight-effect,Robin Stern,3.91,945,2007
The New Codependency: Help and Guidance for Today's Generation (Hardcover),/book/show/5988850-the-new-codependency,Melody Beattie,3.92,1362,2008
Art and Fear: Observations on the Perils (and Rewards) of Artmaking,/book/show/187633.Art_and_Fear,David Bayles,3.73,70544,1993
When Food Is Love: Exploring the Relationship Between Eating and Intimacy (Paperback),/book/show/39175.When_Food_Is_Love,Geneen Roth,4.04,1809,1991
The Birth Order Book: Why You Are the Way You Are (Paperback),/book/show/48760.The_Birth_Order_Book,Kevin Leman,3.78,5704,1984
Take Time for Your Life (Paperback),/book/show/380047.Take_Time_for_Your_Life,Cheryl Richardson,4.01,1745,1998
How to Be Happy; Dammit: A Cynic's Guide to Spiritual Happiness (Paperback),/book/show/690400.How_to_Be_Happy_Dammit,Karen Salmansohn,4.04,878,2001
The No Asshole Rule: Building a Civilized Workplace and Surviving One That Isn't (Hardcover),/book/show/97905.The_No_Asshole_Rule,Robert I. Sutton,3.64,6810,2000
Winning with People (Paperback),/book/show/7538.Winning_with_People,John C. Maxwell,4.27,6162,2005
No Hard Feelings: The Secret Power of Embracing Emotions at Work (Kindle Edition),/book/show/42734244-no-hard-feelings,Liz Fosslien,4.05,1984,2019
The Asshole Survival Guide: How to Deal with People Who Treat You Like Dirt (Hardcover),/book/show/33503509-the-asshole-survival-guide,Robert I. Sutton,3.55,1782,2017
Reviving Ophelia: Saving the Selves of Adolescent Girls (Paperback),/book/show/159760.Reviving_Ophelia,Mary Pipher,3.87,24889,1994
You Are Here: An Owner's Manual for Dangerous Minds (Paperback),/book/show/30360170-you-are-here,Jenny  Lawson,4.29,2848,2017
True Refuge: Finding Peace and Freedom in Your Own Awakened Heart (Kindle Edition),/book/show/40651734-true-refuge,Tara Brach,4.19,2425,2013
7 Strategies for Wealth & Happiness: Power Ideas from America's Foremost Business Philosopher (Paperback),/book/show/764702.7_Strategies_for_Wealth_Happiness,Jim Rohn,4.5,2022,1383
Imagine: How Creativity Works (Hardcover),/book/show/12987640-imagine,Jonah Lehrer,3.81,37207,2012
Autobiography of a Yogi (Paperback),/book/show/639864.Autobiography_of_a_Yogi,Paramahansa Yogananda,4.22,47438,1946
A Million Miles in a Thousand Years: What I Learned While Editing My Life (Hardcover),/book/show/1999475.A_Million_Miles_in_a_Thousand_Years,Donald Miller,4.16,24862,2009
Self-Reliance (Paperback),/book/show/1760630.Self_Reliance,Ralph Waldo Emerson,4.03,7036,1841
Twelve Steps to a Compassionate Life (Audio CD),/book/show/8867135-twelve-steps-to-a-compassionate-life,Karen Armstrong,3.78,3196,2010
She Comes First: The Thinking Man's Guide to Pleasuring a Woman (Hardcover),/book/show/528985.She_Comes_First,Ian Kerner,4.11,5417,2004
The Pursuit of Perfect: How to Stop Chasing Perfection and Start Living a Richer; Happier Life (Hardcover),/book/show/4462310-the-pursuit-of-perfect,Tal Ben-Shahar,4.05,1388,2009
Women's Bodies; Women's Wisdom: Creating Physical and Emotional Health and Healing (Paperback),/book/show/131830.Women_s_Bodies_Women_s_Wisdom,Christiane Northrup,4.33,12223,1994
Life's Little Instruction Book: 511 Suggestions; Observations; and Reminders on How to Live a Happy and Rewarding Life (Paperback),/book/show/968154.Life_s_Little_Instruction_Book,H. Jackson Brown Jr.,4,3359,1940
Don't Sweat the Small Stuff at Work: Simple Ways to Minimize Stress and Conflict While Bringing Out the Best in Yourself and Others (Paperback),/book/show/663401.Don_t_Sweat_the_Small_Stuff_at_Work,Richard Carlson,3.84,1382,1998
Don't Sweat the Small Stuff in Love: Simple Ways to Nurture and Strengthen Your Relationships While Avoiding the Habits That Break Down Your Loving Connection (Hardcover),/book/show/212245.Don_t_Sweat_the_Small_Stuff_in_Love,Richard Carlson,4.05,1992,1999
The Speed Reading Book (Mind Set),/book/show/791505.The_Speed_Reading_Book,Tony Buzan,3.55,2137,1971
How to Be an Antiracist (Hardcover),/book/show/40265832-how-to-be-an-antiracist,Ibram X. Kendi,4.44,51865,2019
Good Habits; Bad Habits: The Science of Making Positive Changes That Stick (Hardcover),/book/show/43565368-good-habits-bad-habits,Wendy Wood,3.74,1079,2019
The Second Mountain (Hardcover),/book/show/40642458-the-second-mountain,David  Brooks,3.74,5148,2019
Lagom: The Swedish Art of Balanced Living (Hardcover),/book/show/35099236-lagom,Linnea Dunne,3.57,3363,2017
Rising Strong as a Spiritual Practice (Audio CD),/book/show/28862373-rising-strong-as-a-spiritual-practice,Bren\xc3\xa9 Brown,4.5,2916,
Ignore Everybody: and 39 Other Keys to Creativity (Hardcover),/book/show/6162567-ignore-everybody,Hugh MacLeod,4,20379,2009
Steal the Show: From Speeches to Job Interviews to Deal-Closing Pitches; How to Guarantee a Standing Ovation for All the Performances in Your Life (Hardcover),/book/show/23214164-steal-the-show,Michael Port,3.68,979,2015
Into the Magic Shop: A Neurosurgeon's Quest to Discover the Mysteries of the Brain and the Secrets of the Heart (Hardcover),/book/show/25733658-into-the-magic-shop,James R. Doty,4.26,9444,2016
Yes Please (Hardcover),/book/show/20910157-yes-please,Amy Poehler,3.83,426329,2014
Warrior Goddess Training: Become the Woman You Are Meant to Be (Paperback),/book/show/21544940-warrior-goddess-training,HeatherAsh Amara,3.99,2896,2014
Zero Waste Home: The Ultimate Guide to Simplifying Your Life by Reducing Your Waste (Paperback),/book/show/15802945-zero-waste-home,Bea Johnson,3.81,6221,2013
Fluent in 3 Months: How Anyone at Any Age Can Learn to Speak Any Language from Anywhere in the World (Paperback),/book/show/18085519-fluent-in-3-months,Benny Lewis,3.66,3978,2014
On Becoming a Person: A Therapist's View of Psychotherapy (Paperback),/book/show/174879.On_Becoming_a_Person,Carl R. Rogers,4.15,13516,1961
Creativity: Flow and the Psychology of Discovery and Invention (Kindle Edition),/book/show/40389418-creativity,Mihaly Csikszentmihalyi,4.08,4795,1996
Emotion Code: How to Release Your Trapped Emotions for Abundant Health; Love and Happiness (Paperback),/book/show/2466469.Emotion_Code,Bradley Nelson,4.06,2078,2007
Fooled by Randomness: The Hidden Role of Chance in Life and in the Markets (Paperback),/book/show/38315.Fooled_by_Randomness,Nassim Nicholas Taleb,4.07,47825,2001
Follow Your Heart (Paperback),/book/show/38903.Follow_Your_Heart,Andrew Matthews,4.23,2056,1999
The World According to Mister Rogers: Important Things to Remember (Hardcover),/book/show/73123.The_World_According_to_Mister_Rogers,Fred Rogers,4.38,4560,2003
Attitude Is Everything: Change Your Attitude... and You Change Your Life! (Paperback),/book/show/482579.Attitude_Is_Everything,Jeff Keller,4.18,3875,1999
The 7 Habits of Highly Effective People Personal Workbook (Paperback),/book/show/2250.The_7_Habits_of_Highly_Effective_People_Personal_Workbook,Stephen R. Covey,4.25,2469,2003
Transitions: Making Sense of Life's Changes (Paperback),/book/show/159615.Transitions,William  Bridges,4.02,2110,1980
The Art of the Start: The Time-Tested; Battle-Hardened Guide for Anyone Starting Anything (Hardcover),/book/show/37875.The_Art_of_the_Start,Guy Kawasaki,3.87,25158,2004
The Path of Least Resistance: Learning to Become the Creative Force in Your Own Life (Paperback),/book/show/994560.The_Path_of_Least_Resistance,Robert Fritz,4.06,1440,1984
Illusions: The Adventures of a Reluctant Messiah (Paperback),/book/show/29946.Illusions,Richard Bach,4.15,56615,1977
You: On a Diet: The Owner's Manual for Waist Management (Hardcover),/book/show/29571.You,Michael F. Roizen,3.66,4843,2009
The New Drawing on the Right Side of the Brain (Paperback),/book/show/627206.The_New_Drawing_on_the_Right_Side_of_the_Brain,Betty Edwards,3.86,295337,1979
Eats; Shoots & Leaves: The Zero Tolerance Approach to Punctuation (Paperback),/book/show/8600.Eats_Shoots_Leaves,Lynne Truss,3.87,96751,2003
This Is Me Letting You Go (Kindle Edition),/book/show/29924756-this-is-me-letting-you-go,Heidi Priebe,4.16,3501,2016
The Choice: Embrace the Possible (Hardcover),/book/show/30753738-the-choice,Edith Eger,4.56,28162,2017
Ta deuxi\xc3\xa8me vie commence quand tu comprends que tu n'en as qu'une (Kindle Edition),/book/show/26805285-ta-deuxi-me-vie-commence-quand-tu-comprends-que-tu-n-en-as-qu-une,Rapha\xc3\xablle Giordano,3.54,10582,2015
The Social Animal: The Hidden Sources of Love; Character; and Achievement (Hardcover),/book/show/9628743-the-social-animal,David  Brooks,3.86,21141,2011
Scary Close: Dropping the Act and Finding True Intimacy (Audio CD),/book/show/23271418-scary-close,Donald Miller,4.1,11824,2015
The Fringe Hours: Making Time for You (Paperback),/book/show/22504623-the-fringe-hours,Jessica N. Turner,3.55,2917,2015
Lean in for Graduates: With New Chapters by Experts; Including Find Your First Job; Negotiate Your Salary; and Own Who You Are (Hardcover),/book/show/20587901-lean-in-for-graduates,Sheryl Sandberg,4.13,3461,2014
The Universe Doesn't Give a Flying Fuck About You (Kindle Edition),/book/show/13628888-the-universe-doesn-t-give-a-flying-fuck-about-you,Johnny B. Truant,3.77,7186,2012
Organized Simplicity: The Clutter-Free Approach to Intentional Living (Hardcover),/book/show/8109713-organized-simplicity,Tsh Oxenreider,3.76,4579,2010
Positivity: Groundbreaking Research Reveals How to Embrace the Hidden Strength of Positive Emotions; Overcome Negativity; and Thrive (Hardcover),/book/show/5629833-positivity,Barbara L. Fredrickson,3.99,2170,2009
Boundaries in Dating (Paperback),/book/show/345149.Boundaries_in_Dating,Henry Cloud,4.13,4107,1999
For One More Day (Hardcover),/book/show/10929.For_One_More_Day,Mitch Albom,4.1,123639,2006
Radical Honesty : How to Transform Your Life by Telling the Truth (Paperback),/book/show/551511.Radical_Honesty_,Brad Blanton,3.85,1906,1994
The Rhythm of Life: Living Every Day with Passion and Purpose (Paperback),/book/show/684383.The_Rhythm_of_Life,Matthew Kelly,4.24,2281,1999
13 Things Mentally Strong Women Don't Do: Own Your Power; Channel Your Confidence; and Find Your Authentic Voice for a Life of Meaning and Joy (ebook),/book/show/37819094-13-things-mentally-strong-women-don-t-do,Amy Morin,3.93,993,2018
Eight Dates: Essential Conversations for a Lifetime of Love (Hardcover),/book/show/37588679-eight-dates,John M. Gottman,4.2,1500,2019
Altered Traits: Science Reveals How Meditation Changes Your Mind; Brain; and Body (Hardcover),/book/show/34272471-altered-traits,Daniel Goleman,3.92,2694,2017
The China Study: The Most Comprehensive Study of Nutrition Ever Conducted and the Startling Implications for Diet; Weight Loss; and Long-term Health (Paperback),/book/show/178788.The_China_Study,T. Colin Campbell,4.23,25375,2001
The Secret Lives of Introverts: Inside Our Hidden World (Paperback),/book/show/35415920-the-secret-lives-of-introverts,Jenn Granneman,3.77,1641,2017
The Rational Male (Paperback),/book/show/18634307-the-rational-male,Rollo Tomassi,4.22,4147,2013
How to Raise an Adult: Break Free of the Overparenting Trap and Prepare Your Kid for Success (Hardcover),/book/show/23168823-how-to-raise-an-adult,Julie Lythcott-Haims,4.14,7071,2015
Bold: How to Go Big; Create Wealth and Impact the World (Hardcover),/book/show/22609444-bold,Peter H. Diamandis,4.02,8303,2015
Everything That Remains: A Memoir by the Minimalists (Paperback),/book/show/20370505-everything-that-remains,Joshua Fields Millburn,3.81,7967,2013
Help Thanks Wow: The Three Essential Prayers (Hardcover),/book/show/15737147-help-thanks-wow,Anne Lamott,3.97,17134,2012
T\xc3\xb4i T\xe1\xbb\xb1 H\xe1\xbb\x8dc (Paperback),/book/show/13638804-t-i-t-h-c,Nguy\xe1\xbb\x85n Duy C\xe1\xba\xa7n,4.24,1591,1959
Always Know What To Say - Easy Ways To Approach And Talk To Anyone (Kindle Edition),/book/show/13565106-always-know-what-to-say---easy-ways-to-approach-and-talk-to-anyone,Peter W. Murphy,3.21,3575,2011
52 Small Changes: One Year to a Happier; Healthier You (Kindle Edition),/book/show/13362937-52-small-changes,Brett Blumenthal,3.41,1418,2011
The 5 Levels of Leadership: Proven Steps to Maximize Your Potential (Hardcover),/book/show/11225698-the-5-levels-of-leadership,John C. Maxwell,4.29,4413,2011
When the Body Says No: The Cost of Hidden Stress (Paperback),/book/show/450534.When_the_Body_Says_No,Gabor Mat\xc3\xa9,4.31,4447,2003
The Art of Manliness: Classic Skills and Manners for the Modern Man (Paperback),/book/show/6962801-the-art-of-manliness,Brett McKay,3.91,2751,2009
Oh; the Places You'll Go! (Hardcover),/book/show/191139.Oh_the_Places_You_ll_Go_,Dr. Seuss,4.35,325736,1990
Passionate Marriage: Keeping Love and Intimacy Alive in Committed Relationships (Paperback),/book/show/6105434-passionate-marriage,David Schnarch,4.13,2776,1997
50 Self-Help Classics: 50 Inspirational Books to Transform Your Life from Timeless Sages to Contemporary Gurus (Paperback),/book/show/149309.50_Self_Help_Classics,Tom Butler-Bowdon,3.92,755,2003
The Relaxation & Stress Reduction Workbook (Paperback),/book/show/842106.The_Relaxation_Stress_Reduction_Workbook,Martha Davis,4.02,1191,1980
The Happiest Baby on the Block: The New Way to Calm Crying and Help Your Newborn Baby Sleep Longer (Mass Market Paperback),/book/show/132900.The_Happiest_Baby_on_the_Block,Harvey Karp,3.91,22333,2002
Children of the Self-Absorbed: A Grown-Up's Guide to Getting over Narcissistic Parents (Paperback),/book/show/180466.Children_of_the_Self_Absorbed,Nina W. Brown,3.92,1181,2000
Ageless Body; Timeless Mind: The Quantum Alternative to Growing Old (Paperback),/book/show/836512.Ageless_Body_Timeless_Mind,Deepak Chopra,4.04,10113,1993
The Saint; the Surfer; and the CEO: A Remarkable Story about Living Your Heart's Desires (Paperback),/book/show/289030.The_Saint_the_Surfer_and_the_CEO,Robin S. Sharma,4.03,3948,2002
The Boy; the Mole; the Fox and the Horse (Hardcover),/book/show/43708884-the-boy-the-mole-the-fox-and-the-horse,Charlie Mackesy,4.61,30672,2019
The F*ck It Diet: Eating Should Be Easy (ebook),/book/show/39893127-the-f-ck-it-diet,Caroline Dooner,4.15,3274,2019
How to Take Smart Notes: One Simple Technique to Boost Writing; Learning and Thinking \xe2\x80\x93 for Students; Academics and Nonfiction Book Writers (Kindle Edition),/book/show/34507927-how-to-take-smart-notes,S\xc3\xb6nke Ahrens,4.32,1704,2017
THINK STRAIGHT: Change Your Thoughts; Change Your Life (Kindle Edition),/book/show/36640169-think-straight,Darius Foroux,3.88,5847,2017
The Art of the Good Life,/book/show/36340275-the-art-of-the-good-life,Rolf Dobelli,4.05,3171,2012
The State of Affairs: Rethinking Infidelity (ebook),/book/show/34017010-the-state-of-affairs,Esther Perel,4.35,8000,2017
Wait; What?: And Life's Other Essential Questions (ebook),/book/show/31307683-wait-what,James E. Ryan,3.94,2993,2017
You Mean I'm Not Lazy; Stupid or Crazy?!: A Self-Help Book for Adults with Attention Deficit Disorder (Paperback),/book/show/1277029.You_Mean_I_m_Not_Lazy_Stupid_or_Crazy_,Kate   Kelly,4,1950,1993
Say Goodbye to Survival Mode: 9 Simple Strategies to Stress Less; Sleep More; and Restore Your Passion for Life (Hardcover),/book/show/18110681-say-goodbye-to-survival-mode,Crystal Paine,3.78,2139,2014
Die Empty: Unleash Your Best Work Every Day (Hardcover),/book/show/16158560-die-empty,Todd Henry,3.83,2471,2013
I Am Gifted; So Are You!,/book/show/1001034.I_Am_Gifted_So_Are_You_,Adam Khoo,4.05,1970,1998
The Year of Magical Thinking (Paperback),/book/show/7815.The_Year_of_Magical_Thinking,Joan Didion,3.89,140166,2005
I Don't Have to Make Everything All Better: Six Practical Principles That Empower Others to Solve Their Own Problems While Enriching Your Relationships (Paperback),/book/show/556935.I_Don_t_Have_to_Make_Everything_All_Better,Gary B. Lundberg,4.14,796,1995
The Explosive Child (Paperback),/book/show/127641.The_Explosive_Child,Ross W. Greene,4.1,6651,1998
Do Nothing: How to Break Away from Overworking; Overdoing; and Underliving (Hardcover),/book/show/52668196-do-nothing,Celeste Headlee,3.89,981,2020
WOLFPACK: How to Come Together; Unleash Our Power; and Change the Game (Hardcover),/book/show/41812857-wolfpack,Abby Wambach,4.06,9893,2019
The Next Right Thing: A Simple; Soulful Practice for Making Life Decisions (Hardcover),/book/show/42244997-the-next-right-thing,Emily P. Freeman,4.38,3498,2019
365 Thank Yous: The Year a Simple Act of Daily Gratitude Changed My Life (Hardcover),/book/show/9543092-365-thank-yous,John Kralik,3.89,3802,2010
Slow: Simple Living for a Frantic World (Hardcover),/book/show/36954707-slow,Brooke McAlary,3.92,2397,2018
What a Time to Be Alone: The Slumflower's Guide to Why You Are Already Enough (Hardcover),/book/show/38744579-what-a-time-to-be-alone,Chidera Eggerue,3.91,3286,2018
