book_title, book_reference, author_names, avg_rating, num_ratings, year_published 
The Subtle Art of Not Giving a F*ck: A Counterintuitive Approach to Living a Good Life (ebook),/book/show/28257707-the-subtle-art-of-not-giving-a-f-ck,Mark Manson,3.94,515636,2016
How to Win Friends and Influence People (Paperback),/book/show/4865.How_to_Win_Friends_and_Influence_People,Dale Carnegie,4.2,600309,1936
The 7 Habits of Highly Effective People: Powerful Lessons in Personal Change (Paperback),/book/show/36072.The_7_Habits_of_Highly_Effective_People,Stephen R. Covey,4.12,517025,1989
The Power of Habit: Why We Do What We Do in Life and Business (Hardcover),/book/show/12609433-the-power-of-habit,Charles Duhigg,4.1,337512,2012
The Life-Changing Magic of Tidying Up: The Japanese Art of Decluttering and Organizing (Hardcover),/book/show/22318578-the-life-changing-magic-of-tidying-up,Marie Kond\xc5\x8d,3.84,275462,2011
You Are a Badass: How to Stop Doubting Your Greatness and Start Living an Awesome Life (Paperback),/book/show/15843166-you-are-a-badass,Jen Sincero,3.95,139026,2013
Atomic Habits: An Easy & Proven Way to Build Good Habits & Break Bad Ones (Kindle Edition),/book/show/40121378-atomic-habits,James Clear,4.35,116151,2018
Quiet: The Power of Introverts in a World That Can't Stop Talking (Hardcover),/book/show/8520610-quiet,Susan Cain,4.06,319847,2012
The Four Agreements: A Practical Guide to Personal Freedom (Hardcover),/book/show/6596.The_Four_Agreements,Miguel Ruiz,4.16,199955,1997
The Power of Now: A Guide to Spiritual Enlightenment (Paperback),/book/show/6708.The_Power_of_Now,Eckhart Tolle,4.13,206222,1997
The Gifts of Imperfection (Paperback),/book/show/7015403-the-gifts-of-imperfection,Bren\xc3\xa9 Brown,4.2,106881,2010
Daring Greatly: How the Courage to Be Vulnerable Transforms the Way We Live; Love; Parent; and Lead (Hardcover),/book/show/13588356-daring-greatly,Bren\xc3\xa9 Brown,4.27,126380,2012
The 5 Love Languages: The Secret to Love that Lasts (Kindle Edition),/book/show/23878688-the-5-love-languages,Gary Chapman,4.25,293246,1990
Who Moved My Cheese? (Hardcover),/book/show/4894.Who_Moved_My_Cheese_,Spencer Johnson,3.82,363524,1998
Think and Grow Rich (Paperback),/book/show/30186948-think-and-grow-rich,Napoleon Hill,4.18,213504,1937
The Secret (The Secret; #1),/book/show/52529.The_Secret,Rhonda Byrne,3.68,344937,2006
The Happiness Project: Or Why I Spent a Year Trying to Sing in the Morning; Clean My Closets; Fight Right; Read Aristotle; and Generally Have More Fun (Hardcover),/book/show/6398634-the-happiness-project,Gretchen Rubin,3.62,143658,2009
Big Magic: Creative Living Beyond Fear (Hardcover),/book/show/24453082-big-magic,Elizabeth Gilbert,3.92,147505,2015
Getting Things Done: The Art of Stress-Free Productivity (Paperback),/book/show/1633.Getting_Things_Done,David    Allen,3.99,126786,2001
Deep Work: Rules for Focused Success in a Distracted World (Hardcover),/book/show/25744928-deep-work,Cal Newport,4.2,71340,2016
Rich Dad; Poor Dad (Paperback),/book/show/69571.Rich_Dad_Poor_Dad,Robert T. Kiyosaki,4.08,362004,1997
The 4-Hour Workweek (ebook),/book/show/368593.The_4_Hour_Workweek,Timothy Ferriss,3.89,176559,2007
How to Stop Worrying and Start Living (Paperback),/book/show/4866.How_to_Stop_Worrying_and_Start_Living,Dale Carnegie,4.14,77278,1944
Girl; Wash Your Face: Stop Believing the Lies about Who You Are So You Can Become Who You Were Meant to Be (ebook),/book/show/35542451-girl-wash-your-face,Rachel Hollis,3.71,175163,2018
Man's Search for Meaning (Paperback),/book/show/4069.Man_s_Search_for_Meaning,Viktor E. Frankl,4.36,391847,1946
The Artist's Way: A Spiritual Path to Higher Creativity (Paperback),/book/show/615570.The_Artist_s_Way,Julia Cameron,3.91,93542,1992
Thinking; Fast and Slow (Hardcover),/book/show/11468377-thinking-fast-and-slow,Daniel Kahneman,4.16,302683,2011
10% Happier: How I Tamed the Voice in My Head; Reduced Stress Without Losing My Edge; and Found Self-Help That Actually Works (Hardcover),/book/show/18505796-10-happier,Dan   Harris,3.92,79470,2014
12 Rules for Life: An Antidote to Chaos (Hardcover),/book/show/30257963-12-rules-for-life,Jordan B. Peterson,3.94,98738,2018
Outliers: The Story of Success (Hardcover),/book/show/3228917-outliers,Malcolm Gladwell,4.16,548639,2008
Mindset: The New Psychology of Success (Hardcover),/book/show/40745.Mindset,Carol S. Dweck,4.07,86023,2006
Men Are from Mars; Women Are from Venus (Paperback),/book/show/1274.Men_Are_from_Mars_Women_Are_from_Venus,John Gray,3.56,162742,1992
Essentialism: The Disciplined Pursuit of Less (Hardcover),/book/show/18077875-essentialism,Greg McKeown,4.04,54479,2011
A New Earth: Awakening to Your Life's Purpose (Paperback),/book/show/76334.A_New_Earth,Eckhart Tolle,4.09,155550,2005
The Alchemist (Paperback),/book/show/18144590-the-alchemist,Paulo Coelho,3.88,2085294,1988
Blink: The Power of Thinking Without Thinking (Paperback),/book/show/40102.Blink,Malcolm Gladwell,3.94,483423,2005
Rising Strong (Hardcover),/book/show/23317538-rising-strong,Bren\xc3\xa9 Brown,4.24,54555,2015
Don't Sweat the Small Stuff ... and It's All Small Stuff: Simple Ways to Keep the Little Things From Taking Over Your Life (Paperback),/book/show/170548.Don_t_Sweat_the_Small_Stuff_and_It_s_All_Small_Stuff,Richard Carlson,3.98,81902,1997
The War of Art: Break Through the Blocks & Win Your Inner Creative Battles (Paperback),/book/show/1319.The_War_of_Art,Steven Pressfield,4,71990,2002
Eat That Frog!: 21 Great Ways to Stop Procrastinating and Get More Done in Less Time (Paperback),/book/show/95887.Eat_That_Frog_,Brian Tracy,3.88,45697,2001
Braving the Wilderness: The Quest for True Belonging and the Courage to Stand Alone (Hardcover),/book/show/34565022-braving-the-wilderness,Bren\xc3\xa9 Brown,4.15,64298,2017
Awaken the Giant Within: How to Take Immediate Control of Your Mental; Emotional; Physical and Financial Destiny! (Paperback),/book/show/180116.Awaken_the_Giant_Within,Tony Robbins,4.15,55782,1992
Grit: The Power of Passion and Perseverance (Hardcover),/book/show/27213329-grit,Angela Duckworth,4.09,67557,2016
The Willpower Instinct: How Self-Control Works; Why It Matters; and What You Can Do to Get More of It (Hardcover),/book/show/10865206-the-willpower-instinct,Kelly McGonigal,4.15,26219,2011
Better Than Before: Mastering the Habits of Our Everyday Lives (Hardcover),/book/show/22889767-better-than-before,Gretchen Rubin,3.84,33185,2015
The Power of Positive Thinking (Hardcover),/book/show/1134122.The_Power_of_Positive_Thinking,Norman Vincent Peale,4.15,83675,1952
The Magic of Thinking Big (Paperback),/book/show/759945.The_Magic_of_Thinking_Big,David J. Schwartz,4.24,68320,1959
The Monk Who Sold His Ferrari: A Fable About Fulfilling Your Dreams and Reaching Your Destiny (Paperback),/book/show/43877.The_Monk_Who_Sold_His_Ferrari,Robin S. Sharma,3.85,106336,1996
The Highly Sensitive Person: How to Thrive When the World Overwhelms You (Paperback),/book/show/923950.The_Highly_Sensitive_Person,Elaine N. Aron,3.87,29166,1996
Boundaries: When to Say Yes; How to Say No to Take Control of Your Life (Hardcover),/book/show/944267.Boundaries,Henry Cloud,4.21,50350,1992
The Miracle Morning: The Not-So-Obvious Secret Guaranteed to Transform Your Life: Before 8AM (Kindle Edition),/book/show/17166225-the-miracle-morning,Hal Elrod,3.93,44377,2012
Flow: The Psychology of Optimal Experience (Paperback),/book/show/66354.Flow,Mihaly Csikszentmihalyi,4.11,54067,1990
Digital Minimalism: Choosing a Focused Life in a Noisy World (Kindle Edition),/book/show/40672036-digital-minimalism,Cal Newport,4.07,31440,2019
Unfu*k Yourself: Get Out of Your Head and Into Your Life (Kindle Edition),/book/show/32738672-unfu-k-yourself,Gary John Bishop,3.86,37196,2016
Feeling Good: The New Mood Therapy (Mass Market Paperback),/book/show/46674.Feeling_Good,David D. Burns,4.03,24430,1980
The Road Less Traveled: A New Psychology of Love; Traditional Values and Spiritual Growth (Paperback),/book/show/347852.The_Road_Less_Traveled,M. Scott Peck,4.06,83161,1978
As a Man Thinketh (Hardcover),/book/show/81959.As_a_Man_Thinketh,James Allen,4.28,57970,1902
Influence: The Psychology of Persuasion (Paperback),/book/show/28815.Influence,Robert B. Cialdini,4.19,99456,1984
You Can Heal Your Life,/book/show/129603.You_Can_Heal_Your_Life,Louise L. Hay,4.16,63058,1984
The 48 Laws of Power (Paperback),/book/show/1303.The_48_Laws_of_Power,Robert Greene,4.16,77020,1998
The Richest Man in Babylon (Paperback),/book/show/1052.The_Richest_Man_in_Babylon,George S. Clason,4.26,108129,1926
Emotional Intelligence: Why It Can Matter More Than IQ (Hardcover),/book/show/26329.Emotional_Intelligence,Daniel Goleman,4.02,81740,1995
The Untethered Soul: The Journey Beyond Yourself (Paperback),/book/show/1963638.The_Untethered_Soul,Michael A. Singer,4.21,49084,2007
The Obstacle Is the Way: The Timeless Art of Turning Trials into Triumph (Hardcover),/book/show/18668059-the-obstacle-is-the-way,Ryan Holiday,4.16,40835,2014
So Good They Can't Ignore You: Why Skills Trump Passion in the Quest for Work You Love (ebook),/book/show/13525945-so-good-they-can-t-ignore-you,Cal Newport,4.11,26537,2012
Lean In: Women; Work; and the Will to Lead (Hardcover),/book/show/16071764-lean-in,Sheryl Sandberg,3.95,219935,2013
The Total Money Makeover: A Proven Plan for Financial Fitness (Hardcover),/book/show/78427.The_Total_Money_Makeover,Dave Ramsey,4.27,69517,1994
Feel the Fear and Do It Anyway (Paperback),/book/show/653396.Feel_the_Fear_and_Do_It_Anyway,Susan  Jeffers,4.03,27319,1987
The Last Lecture (Kindle Edition),/book/show/40611510-the-last-lecture,Randy Pausch,4.26,301296,2008
The One Thing: The Surprisingly Simple Truth Behind Extraordinary Results (Hardcover),/book/show/16256798-the-one-thing,Gary Keller,4.13,43479,2013
Codependent No More: How to Stop Controlling Others and Start Caring for Yourself (Paperback),/book/show/720298.Codependent_No_More,Melody Beattie,4.15,27019,1986
Emotional Intelligence 2.0 (Hardcover),/book/show/6486483-emotional-intelligence-2-0,Travis Bradberry,3.84,70770,2003
The Power of Your Subconscious Mind (Mass Market Paperback),/book/show/68984.The_Power_of_Your_Subconscious_Mind,Joseph Murphy,4.13,44658,1963
The Art of Happiness (Hardcover),/book/show/38210.The_Art_of_Happiness,Dalai Lama XIV,4.16,92185,1998
The Tipping Point: How Little Things Can Make a Big Difference (Paperback),/book/show/2612.The_Tipping_Point,Malcolm Gladwell,3.97,684807,2000
Girl; Stop Apologizing: A Shame-Free Plan for Embracing and Achieving Your Goals (Hardcover),/book/show/40591267-girl-stop-apologizing,Rachel Hollis,3.92,52557,2019
Make Your Bed: Little Things That Can Change Your Life...And Maybe the World (Audiobook),/book/show/31423133-make-your-bed,William H. McRaven,3.99,60654,2017
Mastery (Hardcover),/book/show/13589182-mastery,Robert Greene,4.29,26446,2012
The Life-Changing Magic of Not Giving a F*ck: How to Stop Spending Time You Don't Have with People You Don't Like Doing Things You Don't Want to Do (Hardcover),/book/show/26200068-the-life-changing-magic-of-not-giving-a-f-ck,Sarah Knight,3.44,27249,2015
The Little Book of Hygge: The Danish Way to Live Well (Hardcover),/book/show/30045683-the-little-book-of-hygge,Meik Wiking,3.75,63807,2016
Start with Why: How Great Leaders Inspire Everyone to Take Action (Hardcover),/book/show/7108725-start-with-why,Simon Sinek,4.09,118239,2009
Spark Joy: An Illustrated Master Class on the Art of Organizing and Tidying Up (Hardcover),/book/show/25614984-spark-joy,Marie Kond\xc5\x8d,3.88,31789,2016
Drive: The Surprising Truth About What Motivates Us (Hardcover),/book/show/6452796-drive,Daniel H. Pink,3.95,93461,2009
Maybe You Should Talk to Someone: A Therapist; Her Therapist; and Our Lives Revealed (Hardcover),/book/show/37570546-maybe-you-should-talk-to-someone,Lori Gottlieb,4.37,117558,2019
Ego Is the Enemy (Hardcover),/book/show/27036528-ego-is-the-enemy,Ryan Holiday,4.16,33952,2016
Everything is F*cked: A Book About Hope (Hardcover),/book/show/43808723-everything-is-f-cked,Mark Manson,3.75,35506,2019
Switch: How to Change Things When Change Is Hard (Hardcover),/book/show/6570502-switch,Chip Heath,4.04,42165,2010
Crucial Conversations: Tools for Talking When Stakes Are High (Paperback),/book/show/15014.Crucial_Conversations,Kerry Patterson,4.04,49511,2001
I Thought It Was Just Me: Women Reclaiming Power and Courage in a Culture of Shame (Hardcover),/book/show/279308.I_Thought_It_Was_Just_Me,Bren\xc3\xa9 Brown,4.24,15355,2007
The Defining Decade: Why Your Twenties Matter\xe2\x80\x94And How to Make the Most of Them Now (Kindle Edition),/book/show/40603783-the-defining-decade,Meg Jay,4.14,32568,2012
Tiny Beautiful Things: Advice on Love and Life from Dear Sugar (ebook),/book/show/13152194-tiny-beautiful-things,Cheryl Strayed,4.3,63804,2012
Tools of Titans: The Tactics; Routines; and Habits of Billionaires; Icons; and World-Class Performers (Kindle Edition),/book/show/31823677-tools-of-titans,Timothy Ferriss,4.11,28868,2016
Steal Like an Artist: 10 Things Nobody Told You About Being Creative (Paperback),/book/show/13099738-steal-like-an-artist,Austin Kleon,3.92,196142,2012
He's Just Not That Into You: The No-Excuses Truth to Understanding Guys (Hardcover),/book/show/10412.He_s_Just_Not_That_Into_You,Greg Behrendt,3.66,61443,2004
Wherever You Go; There You Are: Mindfulness Meditation in Everyday Life (Paperback),/book/show/14096.Wherever_You_Go_There_You_Are,Jon Kabat-Zinn,4.12,35857,1994
Never Split the Difference (Hardcover),/book/show/26156469-never-split-the-difference,Chris Voss,4.4,55650,2016
Year of Yes (Paperback),/book/show/29540318-year-of-yes,Shonda Rhimes,4.07,63225,2015
The Compound Effect: Jumpstart Your Income; Your Life; Your Success (Kindle Edition),/book/show/9420697-the-compound-effect,Darren Hardy,4.34,26331,2010
Tuesdays with Morrie (Paperback),/book/show/6900.Tuesdays_with_Morrie,Mitch Albom,4.11,776102,1997
The Happiness Advantage: The Seven Principles of Positive Psychology That Fuel Success and Performance at Work (ebook),/book/show/9484114-the-happiness-advantage,Shawn Achor,4.18,24585,2010
Reasons to Stay Alive (Paperback),/book/show/25733573-reasons-to-stay-alive,Matt Haig,4.16,46454,2015
When Things Fall Apart: Heart Advice for Difficult Times (Paperback),/book/show/687278.When_Things_Fall_Apart,Pema Ch\xc3\xb6dr\xc3\xb6n,4.3,36090,1996
The Body Keeps the Score: Brain; Mind; and Body in the Healing of Trauma (Hardcover),/book/show/18693771-the-body-keeps-the-score,Bessel A. van der Kolk,4.49,35737,2014
The Now Habit: A Strategic Program for Overcoming Procrastination and Enjoying Guilt-Free Play (Paperback),/book/show/95708.The_Now_Habit,Neil A. Fiore,3.9,13736,1988
The Gift of Fear: Survival Signals That Protect Us from Violence (Paperback),/book/show/56465.The_Gift_of_Fear,Gavin de Becker,4.18,29508,1996
The Success Principles: How to Get from Where You Are to Where You Want to Be (Paperback),/book/show/96593.The_Success_Principles,Jack Canfield,4.28,28934,2004
Option B: Facing Adversity; Building Resilience; and Finding Joy (Paperback),/book/show/32938155-option-b,Sheryl Sandberg,3.87,43690,2017
Smarter Faster Better: The Secrets of Being Productive in Life and Business (Hardcover),/book/show/25733966-smarter-faster-better,Charles Duhigg,3.93,25642,2016
How to Talk to Anyone: 92 Little Tricks for Big Success in Relationships (ebook),/book/show/35210.How_to_Talk_to_Anyone,Leil Lowndes,3.77,19923,1998
Can't Hurt Me: Master Your Mind and Defy the Odds (Kindle Edition),/book/show/41721428-can-t-hurt-me,David Goggins,4.42,53098,2018
The 5 Second Rule: Transform Your Life; Work; and Confidence with Everyday Courage (Kindle Edition),/book/show/34189313-the-5-second-rule,Mel Robbins,3.9,20089,2017
Strengths Finder 2.0 (Hardcover),/book/show/56454.Strengths_Finder_2_0,Tom Rath,3.94,47229,2007
The Courage to Be Disliked: How to Free Yourself; Change your Life and Achieve Real Happiness (Paperback),/book/show/43306206-the-courage-to-be-disliked,Ichiro Kishimi,4.11,18448,2013
You Are a Badass at Making Money: Master the Mindset of Wealth (Hardcover),/book/show/30900534-you-are-a-badass-at-making-money,Jen Sincero,3.97,15621,2017
Why We Sleep: Unlocking the Power of Sleep and Dreams (Hardcover),/book/show/34466963-why-we-sleep,Matthew Walker,4.39,71729,2017
Nonviolent Communication: A Language of Life (Paperback),/book/show/71730.Nonviolent_Communication,Marshall B. Rosenberg,4.36,18422,1999
Self-Compassion: The Proven Power of Being Kind to Yourself (Hardcover),/book/show/10127008-self-compassion,Kristin Neff,4.16,10055,2011
The Seven Spiritual Laws of Success: A Practical Guide to the Fulfillment of Your Dreams (Hardcover),/book/show/773038.The_Seven_Spiritual_Laws_of_Success,Deepak Chopra,4.11,55106,1993
Moonwalking with Einstein: The Art and Science of Remembering Everything (Hardcover),/book/show/6346975-moonwalking-with-einstein,Joshua Foer,3.88,72933,2011
The Purpose Driven Life: What on Earth Am I Here for? (Paperback),/book/show/56495.The_Purpose_Driven_Life,Rick Warren,3.94,226554,2002
Dare to Lead (ebook),/book/show/40109367-dare-to-lead,Bren\xc3\xa9 Brown,4.16,40884,2018
Never Eat Alone: And Other Secrets to Success; One Relationship at a Time (Hardcover),/book/show/84699.Never_Eat_Alone,Keith Ferrazzi,3.86,40933,2005
How Will You Measure Your Life? (ebook),/book/show/13425570-how-will-you-measure-your-life,Clayton M. Christensen,4.08,23618,2012
First Things First (Paperback),/book/show/36071.First_Things_First,Stephen R. Covey,4.11,36288,1993
Untamed (Hardcover),/book/show/52129515-untamed,Glennon Doyle,4.17,96395,2020
The Checklist Manifesto: How to Get Things Right (Hardcover),/book/show/6667514-the-checklist-manifesto,Atul Gawande,4.05,47598,2009
Eat; Pray; Love (Paperback),/book/show/19501.Eat_Pray_Love,Elizabeth Gilbert,3.57,1465311,2006
Meditations (Paperback),/book/show/30659.Meditations,Marcus Aurelius,4.23,120863,180
Learned Optimism: How to Change Your Mind and Your Life (Paperback),/book/show/26123.Learned_Optimism,Martin E.P. Seligman,4,15834,1990
The Slight Edge (Paperback),/book/show/590652.The_Slight_Edge,Jeff Olson,4.39,17530,2005
The Power of Vulnerability: Teachings of Authenticity; Connections and Courage (Audible Audio),/book/show/23500254-the-power-of-vulnerability,Bren\xc3\xa9 Brown,4.64,15082,2013
13 Things Mentally Strong People Don't Do: Take Back Your Power; Embrace Change; Face Your Fears; and Train Your Brain for Happiness and Success (Hardcover),/book/show/23215490-13-things-mentally-strong-people-don-t-do,Amy Morin,3.87,9371,2014
Designing Your Life: Build a Life that Works for You (Paperback),/book/show/26046333-designing-your-life,Bill Burnett,3.94,11050,2016
The 7 Habits Of Highly Effective Teens (Paperback),/book/show/783127.The_7_Habits_Of_Highly_Effective_Teens,Sean Covey,4.07,29020,1997
The Millionaire Next Door: The Surprising Secrets of America's Wealthy (Paperback),/book/show/998.The_Millionaire_Next_Door,Thomas J. Stanley,4.04,75269,1995
Attached: The New Science of Adult Attachment and How It Can Help You Find\xe2\x80\x94and Keep\xe2\x80\x94Love (Hardcover),/book/show/9547888-attached,Amir Levine,4.14,18814,2010
Radical Acceptance: Embracing Your Life With the Heart of a Buddha (Paperback),/book/show/173666.Radical_Acceptance,Tara Brach,4.19,16371,2000
Get Your Sh*t Together: How to Stop Worrying About What You Should Do So You Can Finish What You Need to Do and Start Doing What You Want to Do (A No F*cks Given Guide),/book/show/31111142-get-your-sh-t-together,Sarah Knight,3.68,10879,2016
How to Read a Book: The Classic Guide to Intelligent Reading (Paperback),/book/show/567610.How_to_Read_a_Book,Mortimer J. Adler,4,16835,1940
Talking to Strangers: What We Should Know About the People We Don\xe2\x80\x99t Know (Hardcover),/book/show/43848929-talking-to-strangers,Malcolm Gladwell,4.04,126745,2019
Why Men Love Bitches (ebook),/book/show/9201647-why-men-love-bitches,Sherry Argov,3.9,36171,2002
Stumbling on Happiness (Paperback),/book/show/56627.Stumbling_on_Happiness,Daniel Todd Gilbert,3.83,52566,2006
The Dip: A Little Book That Teaches You When to Quit (and When to Stick),/book/show/324748.The_Dip,Seth Godin,3.84,25756,2007
The Dance of Anger: A Woman's Guide to Changing the Patterns of Intimate Relationships (Paperback),/book/show/31312.The_Dance_of_Anger,Harriet Lerner,4.07,19370,1985
The Four Tendencies: The Indispensable Personality Profiles That Reveal How to Make Your Life Better (and Other People's Lives Better; Too),/book/show/33566873-the-four-tendencies,Gretchen Rubin,3.86,14011,2017
The Seven Principles for Making Marriage Work: A Practical Guide from the Country's Foremost Relationship Expert (Paperback),/book/show/849380.The_Seven_Principles_for_Making_Marriage_Work,John M. Gottman,4.23,16880,1999
Six Pillars of Self-Esteem (Paperback),/book/show/79352.Six_Pillars_of_Self_Esteem,Nathaniel Branden,4.17,6592,1994
The Charisma Myth: How Anyone Can Master the Art and Science of Personal Magnetism (Hardcover),/book/show/11910905-the-charisma-myth,Olivia Fox Cabane,3.96,12681,2012
A Mind for Numbers: How to Excel at Math and Science (Even If You Flunked Algebra),/book/show/18693655-a-mind-for-numbers,Barbara Oakley,4.25,12867,2014
Unlimited Power: The New Science Of Personal Achievement (Paperback),/book/show/8676.Unlimited_Power,Anthony Robbins,4.23,29328,1986
The Art of War (Paperback),/book/show/10534.The_Art_of_War,Sun Tzu,3.97,324991,-500
Goodbye; Things: The New Japanese Minimalism (Hardcover),/book/show/30231806-goodbye-things,Fumio Sasaki,3.81,22574,2015
Adulting: How to Become a Grown-up in 468 Easy(ish) Steps,/book/show/15791144-adulting,Kelly Williams Brown,3.73,11797,2013
Happier at Home: Kiss More; Jump More; Abandon a Project; Read Samuel Johnson; and My Other Experiments in the Practice of Everyday Life (Audiobook),/book/show/13414599-happier-at-home,Gretchen Rubin,3.53,16357,2012
What to Say When You Talk to Yourself (Paperback),/book/show/321982.What_to_Say_When_You_Talk_to_Yourself,Shad Helmstetter,4.18,11745,1986
The Happiness Hypothesis: Finding Modern Truth in Ancient Wisdom (Paperback),/book/show/96884.The_Happiness_Hypothesis,Jonathan Haidt,4.12,24995,2005
Willpower: Rediscovering the Greatest Human Strength (Hardcover),/book/show/11104933-willpower,Roy F. Baumeister,3.97,17090,2011
The Bullet Journal Method: Track the Past; Order the Present; Design the Future (Kindle Edition),/book/show/39071691-the-bullet-journal-method,Ryder Carroll,4.06,14583,2018
Loving What Is: Four Questions That Can Change Your Life (Paperback),/book/show/9762.Loving_What_Is,Byron Katie,4.12,17969,2002
The Happiness Trap: How to Stop Struggling and Start Living: A Guide to ACT (Paperback),/book/show/3250347-the-happiness-trap,Russ Harris,4.13,7797,2007
David and Goliath: Underdogs; Misfits; and the Art of Battling Giants (Hardcover),/book/show/15751404-david-and-goliath,Malcolm Gladwell,3.95,146634,2013
The Greatest Salesman in the World (Paperback),/book/show/356896.The_Greatest_Salesman_in_the_World,Og Mandino,4.21,51999,1968
Extreme Ownership: How U.S. Navy SEALs Lead and Win (Hardcover),/book/show/23848190-extreme-ownership,Jocko Willink,4.28,38170,2015
The Mastery of Love: A Practical Guide to the Art of Relationship --Toltec Wisdom Book (Hardcover),/book/show/81939.The_Mastery_of_Love,Miguel Ruiz,4.27,36222,1999
The Introvert Advantage: How to Thrive in an Extrovert World (Paperback),/book/show/49322.The_Introvert_Advantage,Marti Olsen Laney,3.88,15532,2002
How to Fail at Almost Everything and Still Win Big: Kind of the Story of My Life (Hardcover),/book/show/17859574-how-to-fail-at-almost-everything-and-still-win-big,Scott Adams,4.11,13265,2013
Predictably Irrational: The Hidden Forces That Shape Our Decisions (Hardcover),/book/show/1713426.Predictably_Irrational,Dan Ariely,4.13,99565,2008
The Antidote: Happiness for People Who Can't Stand Positive Thinking (ebook),/book/show/13721709-the-antidote,Oliver Burkeman,4.07,9843,2012
What Color Is Your Parachute? A Practical Manual for Job-Hunters and Career-Changers (Paperback),/book/show/6932.What_Color_Is_Your_Parachute_A_Practical_Manual_for_Job_Hunters_and_Career_Changers,Richard Nelson Bolles,3.71,12185,1970
The Book of Joy: Lasting Happiness in a Changing World (Hardcover),/book/show/29496453-the-book-of-joy,Dalai Lama XIV,4.37,33333,2016
Principles: Life and Work (Audio CD),/book/show/34536488-principles,Ray Dalio,4.13,30575,2011
Peak: Secrets from the New Science of Expertise (ebook),/book/show/26312997-peak,K. Anders Ericsson,4.28,10762,2016
Notes on a Nervous Planet (Paperback),/book/show/40404801-notes-on-a-nervous-planet,Matt Haig,4.05,24414,2018
The Year of Less: How I Stopped Shopping; Gave Away My Belongings; and Discovered Life Is Worth More Than Anything You Can Buy in a Store (Hardcover),/book/show/35488858-the-year-of-less,Cait Flanders,3.5,26990,2018
The Talent Code: Unlocking the Secret of Skill in Sports; Art; Music; Math; and Just About Everything Else (Audio CD),/book/show/5771014-the-talent-code,Daniel Coyle,4.08,18765,2009
Act Like a Lady; Think Like a Man: What Men Really Think About Love; Relationships; Intimacy; and Commitment (Hardcover),/book/show/6023056-act-like-a-lady-think-like-a-man,Steve  Harvey,3.81,40938,2009
The Power (The Secret; #2),/book/show/8579016-the-power,Rhonda Byrne,4.1,24461,2009
The Art of Learning: A Journey in the Pursuit of Excellence (Hardcover),/book/show/857333.The_Art_of_Learning,Josh Waitzkin,4.09,14581,2007
Getting to Yes: Negotiating Agreement Without Giving In (Paperback),/book/show/313605.Getting_to_Yes,Roger Fisher,3.94,59698,1981
Present Over Perfect: Leaving Behind Frantic for a Simpler; More Soulful Way of Living (Hardcover),/book/show/27840585-present-over-perfect,Shauna Niequist,3.84,42404,2016
Ikigai: Los secretos de Jap\xc3\xb3n para una vida larga y feliz (Paperback),/book/show/28787203-ikigai,Hector Garcia Puigcerver,3.65,25546,2016
