Level Up Your Life: How to Unlock Adventure and Happiness by Becoming the Hero of Your Own Story (Hardcover),/book/show/24615920-level-up-your-life,Steve Kamb,4.08,2140,2016
The Surrender Experiment: My Journey into Life's Perfection (Paperback),/book/show/23164946-the-surrender-experiment,Michael A. Singer,4.06,6993,2015
Rewire: Change Your Brain to Break Bad Habits; Overcome Addictions; Conquer Self-Destructive Behavior (Hardcover),/book/show/18668061-rewire,Richard O'Connor,3.81,1245,2014
How Not to Be Wrong: The Power of Mathematical Thinking (Hardcover),/book/show/18693884-how-not-to-be-wrong,Jordan Ellenberg,3.96,13959,2014
Subliminal: How Your Unconscious Mind Rules Your Behavior (Hardcover),/book/show/13058637-subliminal,Leonard Mlodinow,4.07,9762,2012
This Will Make You Smarter: New Scientific Concepts to Improve Your Thinking (Paperback),/book/show/13035774-this-will-make-you-smarter,John Brockman,3.8,6305,2012
Seeking Wisdom: From Darwin To Munger (Hardcover),/book/show/1995421.Seeking_Wisdom,Peter Bevelin,4.37,2789,2003
You Are Not Your Brain: The 4-Step Solution for Changing Bad Habits; Ending Unhealthy Thinking; and Taking Control of Your Life (Hardcover),/book/show/9902541-you-are-not-your-brain,Jeffrey M. Schwartz,3.98,1164,2011
Procrastination: Why You Do It; What To Do About It (Paperback),/book/show/1141601.Procrastination,Jane B. Burka,3.91,1382,1982
Black Box Thinking: Why Some People Never Learn from Their Mistakes - But Some Do (Hardcover),/book/show/24611735-black-box-thinking,Matthew Syed,4.32,7075,2015
The Wisdom of No Escape: How to Love Yourself and Your World (Paperback),/book/show/141209.The_Wisdom_of_No_Escape,Pema Ch\xc3\xb6dr\xc3\xb6n,4.29,5937,1991
Sapiens: A Brief History of Humankind (Paperback),/book/show/23692271-sapiens,Yuval Noah Harari,4.42,486317,2011
Girl Code: Unlocking the Secrets to Success; Sanity; and Happiness for the Female Entrepreneur (Paperback),/book/show/26123021-girl-code,Cara Alwill Leyba,3.96,2995,2015
Crucial Confrontations: Tools for Resolving Broken Promises; Violated Expectations; and Bad Behavior (Paperback),/book/show/168962.Crucial_Confrontations,Kerry Patterson,4.12,6543,2004
Letters from a Stoic (Paperback),/book/show/97411.Letters_from_a_Stoic,Seneca,4.34,20668,64
The Whole-Brain Child: 12 Revolutionary Strategies to Nurture Your Child's Developing Mind; Survive Everyday Parenting Struggles; and Help Your Family Thrive (Hardcover),/book/show/10353369-the-whole-brain-child,Daniel J. Siegel,4.21,19153,2011
The Hoarder in You: How to Live a Happier; Healthier; Uncluttered Life (Hardcover),/book/show/11452567-the-hoarder-in-you,Robin Zasio,3.7,1979,2011
Emotional Freedom: Liberate Yourself from Negative Emotions and Transform Your Life (Hardcover),/book/show/3495155-emotional-freedom,Judith Orloff,3.85,1468,2009
The 9 Steps to Financial Freedom: Practical and Spiritual Steps So You Can Stop Worrying (Paperback),/book/show/166021.The_9_Steps_to_Financial_Freedom,Suze Orman,3.75,2953,1997
Please Understand Me II: Temperament; Character; Intelligence (Paperback),/book/show/104190.Please_Understand_Me_II,David Keirsey,4.17,6062,1998
Becoming (Hardcover),/book/show/38746485-becoming,Michelle Obama,4.54,544445,2018
Solve for Happy: Engineer Your Path to Joy (Hardcover),/book/show/30354426-solve-for-happy,Mo Gawdat,3.95,3962,2017
Conversations with God: An Uncommon Dialogue; Book 1 (Hardcover),/book/show/15015.Conversations_with_God,Neale Donald Walsch,4.17,30179,1995
Dare: The New Way to End Anxiety and Stop Panic Attacks Fast (+Bonus Audios),/book/show/26452130-dare,Barry McDonagh,4.25,1987,2015
How to Love (Mindfulness Essentials; #3),/book/show/22309627-how-to-love,Thich Nhat Hanh,4.34,5464,2014
C\xc3\xa0 Ph\xc3\xaa C\xc3\xb9ng Tony (Paperback),/book/show/23276781-c-ph-c-ng-tony,Tony Bu\xe1\xbb\x95i S\xc3\xa1ng,4.24,3571,2014
Wheat Belly: Lose the Wheat; Lose the Weight; and Find Your Path Back to Health (Hardcover),/book/show/11505008-wheat-belly,William  Davis,3.72,28598,2011
Making Habits; Breaking Habits: Why We Do Things; Why We Don't; and How to Make Any Change Stick (Hardcover),/book/show/13587213-making-habits-breaking-habits,Jeremy  Dean,3.68,2134,2012
Unglued: Making Wise Choices in the Midst of Raw Emotions (Paperback),/book/show/13700247-unglued,Lysa TerKeurst,4.19,12209,2012
The Shallows: What the Internet Is Doing to Our Brains (Paperback),/book/show/9778945-the-shallows,Nicholas Carr,3.88,22853,2010
Eat to Live: The Revolutionary Formula for Fast and Sustained Weight Loss (Paperback),/book/show/34451.Eat_to_Live,Joel Fuhrman,4.13,13412,2003
You'll See It When You Believe It: The Way to Your Personal Transformation (Paperback),/book/show/1141544.You_ll_See_It_When_You_Believe_It,Wayne W. Dyer,4.22,4543,1989
10 Secrets for Success and Inner Peace (Hardcover),/book/show/926206.10_Secrets_for_Success_and_Inner_Peace,Wayne W. Dyer,4.29,3428,2001
The Courage to Heal: A Guide for Women Survivors of Child Sexual Abuse (Paperback),/book/show/3090406-the-courage-to-heal,Ellen Bass,4.21,7491,1988
In Defense of Food: An Eater's Manifesto (Hardcover),/book/show/315425.In_Defense_of_Food,Michael Pollan,4.08,101947,2008
Pulling Your Own Strings (Paperback),/book/show/344718.Pulling_Your_Own_Strings,Wayne W. Dyer,4.07,1289,1978
The Mind Illuminated: A Complete Meditation Guide Integrating Buddhist Wisdom and Brain Science (Paperback),/book/show/25942786-the-mind-illuminated,Culadasa (John Yates),4.31,2354,2015
How to Be a Person in the World: Ask Polly's Guide Through the Paradoxes of Modern Life (Hardcover),/book/show/27065373-how-to-be-a-person-in-the-world,Heather Havrilesky,3.84,3396,2016
Rewire Your Anxious Brain: How to Use the Neuroscience of Fear to End Anxiety; Panic; and Worry (Paperback),/book/show/20344354-rewire-your-anxious-brain,Catherine M. Pittman,4.08,1365,2015
Life Is What You Make It: Find Your Own Path to Fulfillment (Hardcover),/book/show/7641110-life-is-what-you-make-it,Peter Buffett,3.78,1694,2010
You Learn by Living: Eleven Keys for a More Fulfilling Life (Paperback),/book/show/78509.You_Learn_by_Living,Eleanor Roosevelt,3.98,3349,1960
Throw Out Fifty Things: Clear the Clutter; Find Your Life (Hardcover),/book/show/5892636-throw-out-fifty-things,Gail Blanke,3.46,2435,2009
The Path Between Us: An Enneagram Journey to Healthy Relationships (Hardcover),/book/show/36638638-the-path-between-us,Suzanne Stabile,4.15,4974,2018
Reclaim Your Heart: Personal Insights on Breaking Free from Life's Shackles (Paperback),/book/show/16112413-reclaim-your-heart,Yasmin Mogahed,4.41,7550,2012
Superhuman by Habit: A Guide to Becoming the Best Possible Version of Yourself; One Tiny Habit at a Time (Kindle Edition),/book/show/23206969-superhuman-by-habit,Tynan,3.79,1980,2014
Willpower Doesn't Work: Discover the Hidden Keys to Success (Hardcover),/book/show/35604684-willpower-doesn-t-work,Benjamin Hardy,4.06,1759,2018
The Honest Truth About Dishonesty: How We Lie to Everyone - Especially Ourselves (Hardcover),/book/show/13426114-the-honest-truth-about-dishonesty,Dan Ariely,3.93,13432,2012
Acres of Diamonds (Paperback),/book/show/49232.Acres_of_Diamonds,Russell H. Conwell,4.21,8047,1892
Why Men Marry Bitches (Kindle Edition),/book/show/33548595-why-men-marry-bitches,Sherry Argov,3.87,8092,2002
The Relationship Cure: A 5 Step Guide to Strengthening Your Marriage; Family; and Friendships (Paperback),/book/show/56511.The_Relationship_Cure,John M. Gottman,4.05,1969,2001
F**k It: The Ultimate Spiritual Way (Paperback),/book/show/4837266-f-k-it,John C. Parkin,3.42,4252,2007
\xd9\x84\xd8\xa7 \xd8\xaa\xd8\xad\xd8\xb2\xd9\x86 (Paperback),/book/show/2750180,\xd8\xb9\xd8\xa7\xd8\xa6\xd8\xb6 \xd8\xa7\xd9\x84\xd9\x82\xd8\xb1\xd9\x86\xd9\x8a,4.13,28177,2003
We Need to Talk: How to Have Conversations that Matter (ebook),/book/show/33385019-we-need-to-talk,Celeste Headlee,3.97,2417,2017
Playing Big: Find Your Voice; Your Mission; Your Message (Paperback),/book/show/25310678-playing-big,Tara Mohr,4.2,3002,2014
The Book of Secrets: Unlocking the Hidden Dimensions of Your Life (Paperback),/book/show/104909.The_Book_of_Secrets,Deepak Chopra,3.97,6510,2004
One Year to an Organized Life: From Your Closets to Your Finances; the Week-by-Week Guide to Getting Completely Organized for Good (Audio CD),/book/show/13543393-one-year-to-an-organized-life,Regina Leeds,3.45,1180,2007
Homecoming: Reclaiming and Healing Your Inner Child (Paperback),/book/show/12124.Homecoming,John Bradshaw,3.99,1379,1990
The Go-Getter (a Story That Tells You How to Be One),/book/show/281881.The_Go_Getter,Peter B. Kyne,4.16,7907,1920
How To Enjoy Your Life And Your Job (Paperback),/book/show/4870.How_To_Enjoy_Your_Life_And_Your_Job,Dale Carnegie,3.98,2567,1955
The Minimalist Home: A Room-By-Room Guide to a Decluttered; Refocused Life (Hardcover),/book/show/39810030-the-minimalist-home,Joshua Becker,3.62,4087,2018
Help Me!: One Woman\xe2\x80\x99s Quest to Find Out if Self-Help Really Can Change Her Life (ebook),/book/show/38136826-help-me,Marianne Power,3.9,3735,2018
The Culture Code: The Secrets of Highly Successful Groups (Hardcover),/book/show/33517721-the-culture-code,Daniel Coyle,4.32,14153,2017
Why Won\xe2\x80\x99t You Apologize?: Healing Big Betrayals and Everyday Hurts (Hardcover),/book/show/29430730-why-won-t-you-apologize,Harriet Lerner,4.31,1903,2017
Psycho-Cybernetics; Updated and Expanded (Paperback),/book/show/24611751-psycho-cybernetics-updated-and-expanded,Maxwell Maltz,4.42,1814,2015
Verbal Judo: The Gentle Art of Persuasion (Paperback),/book/show/865508.Verbal_Judo,George J. Thompson,3.81,3555,1993
The Dance of Fear: Rising Above Anxiety; Fear; and Shame to Be Your Best and Bravest Self (Paperback),/book/show/162749.The_Dance_of_Fear,Harriet Lerner,3.96,1240,2004
Delivering Happiness: A Path to Profits; Passion; and Purpose (Hardcover),/book/show/6828896-delivering-happiness,Tony Hsieh,4,61448,2010
The Book of Awesome (Pasta dura),/book/show/7381647-the-book-of-awesome,Neil Pasricha,3.81,10715,2010
Why Zebras Don't Get Ulcers (Paperback),/book/show/327.Why_Zebras_Don_t_Get_Ulcers,Robert M. Sapolsky,4.17,8769,1993
Screw It; Let's Do It: Lessons In Life (Paperback),/book/show/198863.Screw_It_Let_s_Do_It,Richard Branson,3.93,12875,2006
First; Break All the Rules: What the World's Greatest Managers Do Differently (Hardcover),/book/show/50937.First_Break_All_the_Rules,Marcus Buckingham,3.93,35596,1998
Standing for Something: 10 Neglected Virtues That Will Heal Our Hearts and Homes (Paperback),/book/show/596259.Standing_for_Something,Gordon B. Hinckley,4.6,14038,2000
The Love Dare (Leather Bound),/book/show/4499669-the-love-dare,Stephen Kendrick,4.39,51710,2008
Everybody; Always: Becoming Love in a World Full of Setbacks and Difficult People (Paperback),/book/show/36289256-everybody-always,Bob Goff,4.5,22357,2018
This Is Water: Some Thoughts; Delivered on a Significant Occasion; about Living a Compassionate Life (Hardcover),/book/show/5986375-this-is-water,David Foster Wallace,4.51,22390,2009
Broke Millennial: Stop Scraping by and Get Your Financial Life Together (Paperback),/book/show/32335700-broke-millennial,Erin Lowry,3.95,2407,2017
The Barefoot Investor: The Only Money Guide You'll Ever Need (Kindle Edition),/book/show/33121747-the-barefoot-investor,Scott Pape,4.45,12236,2016
The Curated Closet: A Simple System for Discovering Your Personal Style and Building Your Dream Wardrobe (Paperback),/book/show/28364022-the-curated-closet,Anuschka Rees,3.77,3677,2016
Happy: Why More or Less Everything is Absolutely Fine (Paperback),/book/show/30142270-happy,Derren Brown,4.07,4653,2016
Bounce: Mozart; Federer; Picasso; Beckham; and the Science of Success (Hardcover),/book/show/7845157-bounce,Matthew Syed,4.06,6700,2010
Mastering Your Mean Girl: The No-BS Guide to Silencing Your Inner Critic and Becoming Wildly Wealthy; Fabulously Healthy; and Bursting with Love (Paperback),/book/show/25810365-mastering-your-mean-girl,Melissa Ambrosini,3.87,2028,2016
Men; Women; and Worthiness: The Experience of Shame and the Power of Being Enough (Audio CD),/book/show/15894631-men-women-and-worthiness,Bren\xc3\xa9 Brown,4.51,2044,2012
Fear: Essential Wisdom for Getting Through the Storm (Hardcover),/book/show/13623836-fear,Thich Nhat Hanh,4.09,4046,2012
The Charge: Activating the 10 Human Drives That Make You Feel Alive (Hardcover),/book/show/13260177-the-charge,Brendon Burchard,4.08,1703,2012
The Flinch (Kindle Edition),/book/show/13159280-the-flinch,Julien Smith,3.75,5280,2011
Spontaneous Happiness (Hardcover),/book/show/11542326-spontaneous-happiness,Andrew Weil,3.85,2053,2011
Life Without Limits (Hardcover),/book/show/8639945-life-without-limits,Nick Vujicic,4.14,7305,2007
Status Anxiety (Paperback),/book/show/23425.Status_Anxiety,Alain de Botton,3.91,12729,2004
The Four Agreements Companion Book: Using the Four Agreements to Master the Dream of Your Life (Paperback),/book/show/6597.The_Four_Agreements_Companion_Book,Miguel Ruiz,4.24,3961,2000
The Strangest Secret (Paperback),/book/show/630591.The_Strangest_Secret,Earl Nightingale,4.47,3827,1976
You Just Don't Understand: Women and Men in Conversation (Paperback),/book/show/147222.You_Just_Don_t_Understand,Deborah Tannen,3.87,5534,1990
The Art of Public Speaking (Hardcover),/book/show/3363618-the-art-of-public-speaking,Dale Carnegie,3.89,3543,1915
Me and White Supremacy: Combat Racism; Change the World; and Become a Good Ancestor (Hardcover),/book/show/46002342-me-and-white-supremacy,Layla F. Saad,4.38,12688,2020
The Gratitude Diaries: How a Year Looking on the Bright Side Can Transform Your Life (Hardcover),/book/show/24611936-the-gratitude-diaries,Janice Kaplan,3.9,3664,2015
Hardcore Self Help: F**k Anxiety (Kindle Edition),/book/show/23211224-hardcore-self-help,Robert Duff,3.97,2412,2014
The Art of Stillness: Adventures in Going Nowhere (Hardcover),/book/show/21976060-the-art-of-stillness,Pico Iyer,3.69,5881,2014
The Best Yes: Making Wise Decisions in the Midst of Endless Demands (Paperback),/book/show/18850607-the-best-yes,Lysa TerKeurst,4.14,13150,2014
The Tapping Solution: A Revolutionary System for Stress-Free Living (Hardcover),/book/show/15814365-the-tapping-solution,Nick Ortner,4.02,1761,2013
How to Be Interesting: An Instruction Manual (Paperback),/book/show/17120207-how-to-be-interesting,Jessica Hagy,3.7,2570,2013
Simplify: 7 Guiding Principles to Help Anyone Declutter Their Home and Life (Kindle Edition),/book/show/13049773-simplify,Joshua Becker,3.88,4106,2010
You Are Here: Discovering the Magic of the Present Moment (Hardcover),/book/show/6366371-you-are-here,Thich Nhat Hanh,4.25,5688,2004
Vagabonding: An Uncommon Guide to the Art of Long-Term World Travel (Paperback),/book/show/100247.Vagabonding,Rolf Potts,3.94,20601,2002
Going to Pieces Without Falling Apart: A Buddhist Perspective on Wholeness (Paperback),/book/show/18736.Going_to_Pieces_Without_Falling_Apart,Mark Epstein,3.86,5477,1998
Love Is Letting Go of Fear (Paperback),/book/show/187634.Love_Is_Letting_Go_of_Fear,Gerald G. Jampolsky,4.18,2495,1979
Comfortable with Uncertainty: 108 Teachings on Cultivating Fearlessness and Compassion (Paperback),/book/show/108829.Comfortable_with_Uncertainty,Pema Ch\xc3\xb6dr\xc3\xb6n,4.26,5233,2002
The Memory Book: The Classic Guide to Improving Your Memory at Work; at School; and at Play (Paperback),/book/show/349426.The_Memory_Book,Harry Lorayne,3.98,1938,1974
The Biology of Belief: Unleashing the Power of Consciousness; Matter and Miracles (Hardcover),/book/show/90556.The_Biology_of_Belief,Bruce H. Lipton,4.17,11424,2005
Good Vibes; Good Life: How Self-Love Is the Key to Unlocking Your Greatness (Kindle Edition),/book/show/42186465-good-vibes-good-life,Vex King,4.22,3795,2018
In Conclusion; Don't Worry About It (Kindle Edition),/book/show/36341878-in-conclusion-don-t-worry-about-it,Lauren Graham,3.75,9399,2018
Dot Journaling: A Practical Guide: How to Start and Keep the Planner; To-Do List; and Diary That\xe2\x80\x99ll Actually Help You Get Your Life Together (Paperback),/book/show/33590204-dot-journaling,Rachel Wilkerson Miller,3.75,5742,2017
Almost Adulting: All You Need to Know to Get It Together (Sort Of),/book/show/33296246-almost-adulting,Arden Rose,3.3,3444,2017
Organizing Solutions for People With Attention Deficit Disorder: Tips and Tools to Help You Take Charge of Your Life and Get Organized (Paperback),/book/show/278974.Organizing_Solutions_for_People_With_Attention_Deficit_Disorder,Susan C. Pinsky,4,1327,2006
The Icarus Deception: How High Will You Fly? (Hardcover),/book/show/15843041-the-icarus-deception,Seth Godin,3.99,12271,2012
Pragmatic Thinking and Learning: Refactor Your Wetware (Paperback),/book/show/3063393-pragmatic-thinking-and-learning,Andy Hunt,4.12,3840,2008
The Emotionally Absent Mother: A Guide to Self-Healing and Getting the Love You Missed (Paperback),/book/show/9268619-the-emotionally-absent-mother,Jasmin Lee Cori,4.15,1105,2010
Things I Wish I'd Known Before We Got Married (Paperback),/book/show/8191304-things-i-wish-i-d-known-before-we-got-married,Gary Chapman,4.01,5667,2010
What You Can Change and What You Can't: The Complete Guide to Successful Self-Improvement (Paperback),/book/show/28013.What_You_Can_Change_and_What_You_Can_t,Martin E.P. Seligman,3.86,1107,1993
Getting Unstuck: Breaking Your Habitual Patterns & Encountering Naked Reality (Audio CD),/book/show/136975.Getting_Unstuck,Pema Ch\xc3\xb6dr\xc3\xb6n,4.19,3083,2004
Healing Your Emotional Self: A Powerful Program to Help You Raise Your Self-Esteem; Quiet Your Inner Critic; and Overcome Your Shame (Hardcover),/book/show/129707.Healing_Your_Emotional_Self,Beverly Engel,4.05,604,2006
Happy for No Reason: 7 Steps to Being Happy from the Inside Out (Hardcover),/book/show/1054479.Happy_for_No_Reason,Marci Shimoff,4.03,2164,2008
The 100 Simple Secrets of Happy People: What Scientists Have Learned and How You Can Use It (Paperback),/book/show/441261.The_100_Simple_Secrets_of_Happy_People,David Niven,3.6,1890,2000
Tell Me More: Stories about the 12 Hardest Things I'm Learning to Say (Hardcover),/book/show/35018200-tell-me-more,Kelly Corrigan,4.18,14415,2018
Quiet Power: The Secret Strengths of Introverts (Hardcover),/book/show/23398681-quiet-power,Susan Cain,3.93,4168,2016
How to Be Here: A Guide to Creating a Life Worth Living (Hardcover),/book/show/22124291-how-to-be-here,Rob Bell,3.94,4202,2016
Hyperbole and a Half: Unfortunate Situations; Flawed Coping Mechanisms; Mayhem; and Other Things That Happened (Paperback),/book/show/17571564-hyperbole-and-a-half,Allie Brosh,4.15,174659,2013
The Examined Life: How We Lose and Find Ourselves (Paperback),/book/show/18378023-the-examined-life,Stephen Grosz,3.92,12165,2012
To Sell is Human: The Surprising Truth About Moving Others (Hardcover),/book/show/13593553-to-sell-is-human,Daniel H. Pink,3.9,18718,2012
Mastermind: How to Think Like Sherlock Holmes (Hardcover),/book/show/15805442-mastermind,Maria Konnikova,3.54,6396,2013
It Starts with Food: Discover the Whole30 and Change Your Life in Unexpected Ways (Hardcover),/book/show/13193855-it-starts-with-food,Dallas Hartwig,4.09,21776,2012
What the Dog Saw and Other Adventures (Hardcover),/book/show/6516450-what-the-dog-saw-and-other-adventures,Malcolm Gladwell,3.85,88798,2009
The Prince (Paperback),/book/show/28862.The_Prince,Niccol\xc3\xb2 Machiavelli,3.82,257163,1532
Further Along the Road Less Traveled: The Unending Journey Towards Spiritual Growth (Paperback),/book/show/7371.Further_Along_the_Road_Less_Traveled,M. Scott Peck,4.08,5299,1993
What I Talk About When I Talk About Running (Hardcover),/book/show/2195464.What_I_Talk_About_When_I_Talk_About_Running,Haruki Murakami,3.85,104648,2007
"HBR\'s 10 Must Reads on Managing Yourself (with bonus article ""How Will You Measure Your Life?"")",/book/show/8308501-hbr-s-10-must-reads-on-managing-yourself,Clayton M. Christensen,4.03,3124,2010
So You Want to Talk About Race (Hardcover),/book/show/35099718-so-you-want-to-talk-about-race,Ijeoma Oluo,4.53,57664,2018
Choose Wonder Over Worry: Move Beyond Fear and Doubt to Unlock Your Full Potential (Hardcover),/book/show/36516721-choose-wonder-over-worry,Amber  Rae,3.89,1231,
Power vs. Force (Paperback),/book/show/19795.Power_vs_Force,David R. Hawkins,4.16,8985,1985
The Coaching Habit: Say Less; Ask More & Change the Way You Lead Forever (Kindle Edition),/book/show/29342515-the-coaching-habit,Michael Bungay Stanier,4.01,11083,2016
ADD-Friendly Ways to Organize Your Life (Paperback),/book/show/548523.ADD_Friendly_Ways_to_Organize_Your_Life,Judith Kolberg,4.03,1511,2002
Pretty Happy: Healthy Ways To Love Your Body (Hardcover),/book/show/25817773-pretty-happy,Kate  Hudson,3.55,3308,2016
I Know How She Does It: How Successful Women Make the Most of Their Time (Hardcover),/book/show/23399024-i-know-how-she-does-it,Laura Vanderkam,3.72,3477,2015
You Can Be Happy No Matter What: Five Principles for Keeping Life in Perspective (Hardcover),/book/show/100287.You_Can_Be_Happy_No_Matter_What,Richard Carlson,4.11,1268,1992
The Secret Letters of the Monk Who Sold His Ferrari (Paperback),/book/show/10695150-the-secret-letters-of-the-monk-who-sold-his-ferrari,Robin S. Sharma,4.03,7902,2011
The Upside of Irrationality: The Unexpected Benefits of Defying Logic at Work and at Home (Hardcover),/book/show/7815744-the-upside-of-irrationality,Dan Ariely,4.04,32281,2010
On Death and Dying (Paperback),/book/show/781844.On_Death_and_Dying,Elisabeth K\xc3\xbcbler-Ross,4.17,23913,1969
QBQ! The Question Behind the Question: Practicing Personal Accountability in Work and in Life (Hardcover),/book/show/168981.QBQ_The_Question_Behind_the_Question,John G. Miller,3.86,8980,2001
How to Talk to Anyone; Anytime; Anywhere: The Secrets of Good Communication (Hardcover),/book/show/35211.How_to_Talk_to_Anyone_Anytime_Anywhere,Larry King,3.53,3076,1994
Undoing Depression: What Therapy Doesn't Teach You and Medication Can't Give You (Paperback),/book/show/397347.Undoing_Depression,Richard O'Connor,3.99,1033,1997
The Money Book for the Young; Fabulous & Broke (Paperback),/book/show/127277.The_Money_Book_for_the_Young_Fabulous_Broke,Suze Orman,3.9,6210,2004
My Morning Routine: How Successful People Start Every Day Inspired (Hardcover),/book/show/36026834-my-morning-routine,Benjamin Spall,3.52,1866,2018
I Hear You: The Surprisingly Simple Skill Behind Extraordinary Relationships (Kindle Edition),/book/show/35522033-i-hear-you,Michael S. Sorensen,4.14,3397,2017
Lateral Thinking (Paperback),/book/show/829616.Lateral_Thinking,Edward de Bono,3.8,3509,1970
10 Steps to Earning Awesome Grades (While Studying Less),/book/show/24377513-10-steps-to-earning-awesome-grades,Thomas   Frank,4.32,2770,2015
Miracles Now: 108 Life-Changing Tools for Less Stress; More Flow; and Finding Your True Purpose (Hardcover),/book/show/20133597-miracles-now,Gabrielle Bernstein,3.91,2596,2014
Life Code: The New Rules For Winning in the Real World (Hardcover),/book/show/17155775-life-code,Phillip C. McGraw,3.77,2411,2012
What to Expect the First Year (What to Expect),/book/show/98.What_to_Expect_the_First_Year,Heidi Murkoff,3.89,15870,1989
The Secrets of Happy Families: Improve Your Mornings; Rethink Family Dinner; Fight Smarter; Go Out and Play; and Much More (Hardcover),/book/show/15818077-the-secrets-of-happy-families,Bruce Feiler,3.97,4299,2013
The Myths of Happiness (Hardcover),/book/show/15811501-the-myths-of-happiness,Sonja Lyubomirsky,3.66,1539,2012
Wired for Love: How Understanding Your Partner's Brain and Attachment Style Can Help You Defuse Conflict and Build a Secure Relationship (Paperback),/book/show/13225387-wired-for-love,Stan Tatkin,4.15,1902,2012
Quitter: Closing the Gap Between Your Day Job and Your Dream Job (Hardcover),/book/show/10836740-quitter,Jon Acuff,3.96,5844,2011
Yes!: 50 Scientifically Proven Ways to Be Persuasive (Hardcover),/book/show/2208661.Yes_,Noah J. Goldstein,4,10758,2008
In Sheep's Clothing: Understanding and Dealing with Manipulative People (Paperback),/book/show/378161.In_Sheep_s_Clothing,George K. Simon Jr.,4.06,2888,1996
One Day My Soul Just Opened Up: 40 Days and 40 Nights Toward Spiritual Strength and Personal Growth (Hardcover),/book/show/30453.One_Day_My_Soul_Just_Opened_Up,Iyanla Vanzant,4.12,8523,1998
You Are Now Less Dumb: How to Conquer Mob Mentality; How to Buy Happiness; and All the Other Ways to Outsmart Yourself (Hardcover),/book/show/16101143-you-are-now-less-dumb,David McRaney,3.94,3812,2013
Super Attractor: Methods for Manifesting a Life beyond Your Wildest Dreams (Hardcover),/book/show/43496426-super-attractor,Gabrielle Bernstein,4.19,3508,2019
How to Fail: Everything I\xe2\x80\x99ve Ever Learned From Things Going Wrong (Hardcover),/book/show/42949842-how-to-fail,Elizabeth Day,4.02,5724,2019
The Motivation Myth: How High Achievers Really Set Themselves Up to Win (Hardcover),/book/show/34962304-the-motivation-myth,Jeff Haden,3.83,1770,2018
A New Guide to Rational Living (Paperback),/book/show/22673.A_New_Guide_to_Rational_Living,Albert Ellis,4.07,1524,1961
Rest: Why You Get More Done When You Work Less (Hardcover),/book/show/29502354-rest,Alex Soojung-Kim Pang,3.83,2430,2016
Resisting Happiness (ebook),/book/show/31341738-resisting-happiness,Matthew Kelly,4.1,4394,2016
The Depression Cure: The 6-Step Program to Beat Depression without Drugs (Hardcover),/book/show/6446928-the-depression-cure,Stephen S. Ilardi,4.11,1564,2010
Small Move; Big Change: Using Microresolutions to Transform Your Life Permanently (Hardcover),/book/show/18079652-small-move-big-change,Caroline L. Arnold,3.82,1192,2014
Living Beautifully: with Uncertainty and Change (Hardcover),/book/show/13414918-living-beautifully,Pema Ch\xc3\xb6dr\xc3\xb6n,4.24,4480,2012
Life Is a Verb: 37 Days to Wake Up; Be Mindful; and Live Intentionally (Paperback),/book/show/4204732-life-is-a-verb,Patti Digh,3.96,2461,2008
