The Practicing Mind: Bringing Discipline and Focus into Your Life (Paperback),/book/show/335864.The_Practicing_Mind,Thomas M. Sterner,4,5792,2006
Finding Your Own North Star: Claiming the Life You Were Meant to Live (Paperback),/book/show/66140.Finding_Your_Own_North_Star,Martha N. Beck,4.07,5404,1997
The Art of Non-Conformity: Set Your Own Rules; Live the Life You Want; and Change the World (ebook),/book/show/8978488-the-art-of-non-conformity,Chris Guillebeau,3.87,9371,2014
The Code of the Extraordinary Mind: 10 Unconventional Laws to Redefine Your Life and Succeed On Your Own Terms (Hardcover),/book/show/26114571-the-code-of-the-extraordinary-mind,Vishen Lakhiani,4.11,5752,2016
Battlefield Of The Mind: Winning The Battle In Your Mind (Paperback),/book/show/254389.Battlefield_Of_The_Mind,Joyce Meyer,4.34,57445,1995
Everything Is Figureoutable (Paperback),/book/show/43706482-everything-is-figureoutable,Marie Forleo,4.1,6247,2019
TED Talks: The Official TED Guide to Public Speaking (Kindle Edition),/book/show/41044212-ted-talks,Chris J. Anderson,4.15,9023,2016
The Desire Map,/book/show/16279838-the-desire-map,Danielle LaPorte,4,6593,2012
Law of Success (Paperback),/book/show/105232.Law_of_Success,Napoleon Hill,4.41,9188,1925
The First 20 Hours: How to Learn Anything...Fast (Hardcover),/book/show/16158493-the-first-20-hours,Josh Kaufman,3.49,4950,2013
The Seat of the Soul (Hardcover),/book/show/119760.The_Seat_of_the_Soul,Gary Zukav,4.01,39967,1989
The 5 Elements of Effective Thinking (Hardcover),/book/show/14891980-the-5-elements-of-effective-thinking,Edward B. Burger,4.08,5792,2012
It's All Too Much: An Easy Plan for Living a Richer Life with Less Stuff (Hardcover),/book/show/34266.It_s_All_Too_Much,Peter Walsh,3.85,5417,2006
The Feeling Good Handbook (Paperback),/book/show/2222.The_Feeling_Good_Handbook,David D. Burns,4.01,5241,1989
The Chimp Paradox: The Acclaimed Mind Management Programme to Help You Achieve Success; Confidence and Happiness (Paperback),/book/show/12228097-the-chimp-paradox,Steve   Peters,4.02,11294,2012
The More of Less: Finding the Life You Want Under Everything You Own (Hardcover),/book/show/27036703-the-more-of-less,Joshua Becker,3.79,9358,2016
Mindfulness in Plain English (Paperback),/book/show/64369.Mindfulness_in_Plain_English,Henepola Gunaratana,4.19,12802,1992
Rich Dad's Cashflow Quadrant: Rich Dad's Guide to Financial Freedom (Paperback),/book/show/81922.Rich_Dad_s_Cashflow_Quadrant,Robert T. Kiyosaki,4.12,40133,1998
Gmorning; Gnight!: Little Pep Talks for Me & You (Kindle Edition),/book/show/40854717-gmorning-gnight,Lin-Manuel Miranda,4.33,16978,2018
The Body Is Not an Apology: The Power of Radical Self-Love (Paperback),/book/show/34956885-the-body-is-not-an-apology,Sonya Renee Taylor,4.28,4669,2018
Search Inside Yourself: The Unexpected Path to Achieving Success; Happiness (And World Peace),/book/show/12921211-search-inside-yourself,Chade-Meng Tan,4.09,6483,2012
Tiny Habits: The Small Changes That Change Everything (Hardcover),/book/show/43261127-tiny-habits,B.J. Fogg,4.15,2565,2019
First; We Make the Beast Beautiful: A New Story About Anxiety (Hardcover),/book/show/34210334-first-we-make-the-beast-beautiful,Sarah Wilson,3.83,7410,2017
Very Good Lives: The Fringe Benefits of Failure and the Importance of Imagination (Hardcover),/book/show/23731881-very-good-lives,J.K. Rowling,4.18,24077,2015
How to Develop Self-Confidence And Influence People (Paperback),/book/show/4868.How_to_Develop_Self_Confidence_And_Influence_People,Dale Carnegie,4.14,4766,1905
You Can Win: A Step by Step Tool for Top Achievers (Paperback),/book/show/714711.You_Can_Win,Shiv Khera,3.9,15735,1998
Excuses Begone!: How to Change Lifelong; Self-Defeating Thinking Habits (Hardcover),/book/show/6294709-excuses-begone,Wayne W. Dyer,4.17,7582,2009
Introvert Power: Why Your Inner Life Is Your Hidden Strength (Paperback),/book/show/3260326-introvert-power,Laurie A. Helgoe,3.93,4320,2008
Mind Over Mood: Change How You Feel By Changing the Way You Think (Paperback),/book/show/108380.Mind_Over_Mood,Dennis Greenberger,4.05,3016,1995
How to Change Your Mind: What the New Science of Psychedelics Teaches Us About Consciousness; Dying; Addiction; Depression; and Transcendence (Hardcover),/book/show/36613747-how-to-change-your-mind,Michael Pollan,4.22,40048,2018
Zen Mind; Beginner's Mind: Informal Talks on Zen Meditation and Practice (Paperback),/book/show/402843.Zen_Mind_Beginner_s_Mind,Shunryu Suzuki,4.22,35567,1970
Self Matters: Creating Your Life from the Inside Out (Hardcover),/book/show/169487.Self_Matters,Phillip C. McGraw,3.65,10772,2001
A Whole New Mind: Why Right-Brainers Will Rule the Future (Paperback),/book/show/99315.A_Whole_New_Mind,Daniel H. Pink,3.94,25802,2004
Driven to Distraction: Recognizing and Coping with Attention Deficit Disorder from Childhood Through Adulthood (Paperback),/book/show/108593.Driven_to_Distraction,Edward M. Hallowell; M.D.,4.13,8469,1992
How to Have Confidence and Power in Dealing with People (Paperback),/book/show/320817.How_to_Have_Confidence_and_Power_in_Dealing_with_People,Les Giblin,4.28,10829,1956
Games People Play (Mass Market Paperback),/book/show/49176.Games_People_Play,Eric Berne,3.81,27374,1964
Mindsight: The New Science of Personal Transformation (Hardcover),/book/show/6315775-mindsight,Daniel J. Siegel,4.15,7382,2009
The Energy Bus: 10 Rules to Fuel Your Life; Work; and Team with Positive Energy (Hardcover),/book/show/81107.The_Energy_Bus,Jon Gordon,3.88,13954,2007
Radical Candor: Be a Kickass Boss Without Losing Your Humanity (Hardcover),/book/show/29939161-radical-candor,Kim Malone Scott,4.16,18534,2017
Tu\xe1\xbb\x95i Tr\xe1\xba\xbb \xc4\x90\xc3\xa1ng Gi\xc3\xa1 Bao Nhi\xc3\xaau (Paperback),/book/show/32521178-tu-i-tr-ng-gi-bao-nhi-u,Rosie Nguy\xe1\xbb\x85n,4.31,9859,2017
When Breath Becomes Air (Kindle Edition),/book/show/25899336-when-breath-becomes-air,Paul Kalanithi,4.36,409289,2016
Organizing from the Inside Out: The Foolproof System for Organizing Your Home; Your Office and Your Life (Paperback),/book/show/220713.Organizing_from_the_Inside_Out,Julie Morgenstern,3.9,5484,1998
Turning Pro (Kindle Edition),/book/show/14912777-turning-pro,Steven Pressfield,4.21,8803,2012
How to Live on 24 Hours a Day (Paperback),/book/show/4855.How_to_Live_on_24_Hours_a_Day,Arnold Bennett,3.68,5373,1908
Nice Girls Don't Get the Corner Office: 101 Unconscious Mistakes Women Make That Sabotage Their Careers (Paperback),/book/show/97641.Nice_Girls_Don_t_Get_the_Corner_Office,Lois P. Frankel,3.76,11795,2004
The Little Book of Lykke: The Danish Search for the World's Happiest People (Hardcover),/book/show/34879265-the-little-book-of-lykke,Meik Wiking,4.02,9809,2017
All I Really Need to Know I Learned in Kindergarten (Paperback),/book/show/34760.All_I_Really_Need_to_Know_I_Learned_in_Kindergarten,Robert Fulghum,4.03,20581,1988
Why Does He Do That?: Inside the Minds of Angry and Controlling Men (Paperback),/book/show/224552.Why_Does_He_Do_That_,Lundy Bancroft,4.5,6843,2002
The Anxiety and Phobia Workbook (Paperback),/book/show/8527134-the-anxiety-and-phobia-workbook,Edmund J. Bourne,4.17,3684,1990
Love Warrior (Hardcover),/book/show/31845516-love-warrior,Glennon Doyle Melton,4.09,51400,2016
Focus: The Hidden Driver of Excellence (Hardcover),/book/show/17349126-focus,Daniel Goleman,3.55,8895,2013
Buddha's Brain: The Practical Neuroscience of Happiness; Love; and Wisdom (Paperback),/book/show/6796675-buddha-s-brain,Rick Hanson,4.03,10089,2009
The Traveler's Gift: Seven Decisions that Determine Personal Success (Paperback),/book/show/56466.The_Traveler_s_Gift,Andy Andrews,4.11,13494,2002
The Game: Penetrating the Secret Society of Pickup Artists (Hardcover),/book/show/900.The_Game,Neil Strauss,3.74,25363,2005
How to Stop Feeling Like Sh*t: 14 Habits that Are Holding You Back from Happiness (Paperback),/book/show/35099719-how-to-stop-feeling-like-sh-t,Andrea Owen,3.73,2415,2018
Algorithms to Live By: The Computer Science of Human Decisions (Hardcover),/book/show/25666050-algorithms-to-live-by,Brian Christian,4.15,18702,2016
How Not to Die: Discover the Foods Scientifically Proven to Prevent and Reverse Disease (Hardcover),/book/show/25663961-how-not-to-die,Michael Greger,4.51,21496,2015
The Upside of Stress: Why Stress Is Good for You; and How to Get Good at It (Hardcover),/book/show/23281639-the-upside-of-stress,Kelly McGonigal,4.2,3503,2012
Unf*ck Your Habitat: You're Better Than Your Mess (Hardcover),/book/show/29939402-unf-ck-your-habitat,Rachel  Hoffman,3.8,3335,2017
Sleep Smarter: 21 Essential Strategies to Sleep Your Way to A Better Body; Better Health; and Bigger Success (Hardcover),/book/show/26114128-sleep-smarter,Shawn Stevenson,4.03,4779,2014
Failing Forward: Turning Mistakes Into Stepping Stones for Success (Hardcover),/book/show/628070.Failing_Forward,John C. Maxwell,4.29,7857,2000
The Five Dysfunctions of a Team: A Leadership Fable (Hardcover),/book/show/21343.The_Five_Dysfunctions_of_a_Team,Patrick Lencioni,4.06,78098,1998
The Language of Letting Go: Daily Meditations on Codependency (Hazelden Meditation Series),/book/show/526134.The_Language_of_Letting_Go,Melody Beattie,4.43,5826,1990
Success Through a Positive Mental Attitude (Paperback),/book/show/948213.Success_Through_a_Positive_Mental_Attitude,Napoleon Hill,4.34,7814,1960
You're Not Listening: What You're Missing and Why It Matters (Hardcover),/book/show/45892276-you-re-not-listening,Kate   Murphy,4.13,3509,2020
How Successful People Think: Change Your Thinking; Change Your Life (Hardcover),/book/show/6012533-how-successful-people-think,John C. Maxwell,4.03,7707,2003
When Bad Things Happen to Good People (Paperback),/book/show/46676.When_Bad_Things_Happen_to_Good_People,Harold S. Kushner,4.03,14502,1981
Crush It!: Why Now Is the Time to Cash In on Your Passion (Hardcover),/book/show/6474550-crush-it,Gary Vaynerchuk,3.89,27942,2009
Just Listen: Discover the Secret to Getting Through to Absolutely Anyone (Hardcover),/book/show/6547576-just-listen,Mark Goulston,4.12,6557,2009
How to Win Friends and Influence People in the Digital Age (Kindle Edition),/book/show/12176421-how-to-win-friends-and-influence-people-in-the-digital-age,Dale Carnegie,3.97,6707,2011
The Intelligent Investor (Paperback),/book/show/106835.The_Intelligent_Investor,Benjamin Graham,4.24,78385,1949
Real Happiness: A 28-Day Program to Realize the Power of Meditation (Paperback),/book/show/49913579-real-happiness,Sharon Salzberg,4.05,4172,2013
See You at the Top: 25th Anniversary Edition (Hardcover),/book/show/161415.See_You_at_the_Top,Zig Ziglar,4.27,12443,1974
Relentless: From Good to Great to Unstoppable (Paperback),/book/show/17354208-relentless,Tim S. Grover,4.02,7241,2014
Siddhartha (Mass Market Paperback),/book/show/52036.Siddhartha,Hermann Hesse,4.03,577118,1922
The Fifth Agreement: A Practical Guide to Self-Mastery (Hardcover),/book/show/6979404-the-fifth-agreement,Miguel Ruiz,4.16,7944,2009
Calm the F*ck Down: How to Control What You Can and Accept What You Can't So You Can Stop Freaking Out and Get On With Your Life (Hardcover),/book/show/40163062-calm-the-f-ck-down,Sarah Knight,3.46,3903,2018
What Got You Here Won't Get You There: How Successful People Become Even More Successful (Hardcover),/book/show/84525.What_Got_You_Here_Won_t_Get_You_There,Marshall Goldsmith,3.98,22569,2007
The Law of Attraction: The Basics of the Teachings of Abraham (Hardcover),/book/show/343614.The_Law_of_Attraction,Esther Hicks,4.14,17573,2006
Life Strategies: Doing What Works; Doing What Matters (Mass Market Paperback),/book/show/522229.Life_Strategies,Phillip C. McGraw,3.63,6283,1999
Discipline Equals Freedom: Field Manual (Kindle Edition),/book/show/34431560-discipline-equals-freedom,Jocko Willink,4.1,8076,
Reading People: How Seeing the World through the Lens of Personality Changes Everything (Kindle Edition),/book/show/34713218-reading-people,Anne Bogel,3.78,7433,2017
The Dance of Intimacy: A Woman's Guide to Courageous Acts of Change in Key Relationships (Paperback),/book/show/31316.The_Dance_of_Intimacy,Harriet Lerner,4.07,7891,1989
Emotional First Aid: Practical Strategies for Treating Failure; Rejection; Guilt; and Other Everyday Psychological Injuries (Hardcover),/book/show/16158512-emotional-first-aid,Guy Winch,4,1969,2013
Eat Move Sleep: How Small Choices Lead to Big Changes (Hardcover),/book/show/17465697-eat-move-sleep,Tom Rath,3.57,5570,2013
The Mindful Path to Self-Compassion: Freeing Yourself from Destructive Thoughts and Emotions (Paperback),/book/show/6265779-the-mindful-path-to-self-compassion,Christopher K. Germer,4.16,2711,2009
Finding Your Element: How to Discover Your Talents and Passions and Transform Your Life (Hardcover),/book/show/16158494-finding-your-element,Ken Robinson,3.89,4033,2013
The Marshmallow Test: Mastering Self-Control (Hardcover),/book/show/20454074-the-marshmallow-test,Walter Mischel,3.76,6004,2014
The Effective Executive: The Definitive Guide to Getting the Right Things Done (Paperback),/book/show/48019.The_Effective_Executive,Peter F. Drucker,4.09,27776,1966
Daily Rituals: How Artists Work (Hardcover),/book/show/15799151-daily-rituals,Mason Currey,3.66,14536,2013
Uninvited: Living Loved When You Feel Less Than; Left Out; and Lonely (Paperback),/book/show/27840705-uninvited,Lysa TerKeurst,4.22,22976,2016
Maximum Achievement: Strategies and Skills that Will Unlock Your Hidden Powers to Succeed (Paperback),/book/show/115613.Maximum_Achievement,Brian Tracy,4.28,3770,1993
Decluttering at the Speed of Life: Winning Your Never-Ending Battle with Stuff (ebook),/book/show/35540769-decluttering-at-the-speed-of-life,Dana K. White,4.06,4890,2018
Uninvited: Living Loved When You Feel Less Than; Left Out; and Lonely (Paperback),/book/show/27840705-uninvited,Lysa TerKeurst,4.22,22976,2016
Happier: Learn the Secrets to Daily Joy and Lasting Fulfillment (Hardcover),/book/show/302971.Happier,Tal Ben-Shahar,3.87,5934,2007
The Easy Way to Stop Smoking: Join the Millions Who Have Become Nonsmokers Using the Easyway Method (Hardcover),/book/show/6618.The_Easy_Way_to_Stop_Smoking,Allen Carr,4.3,9330,1985
On the Shortness of Life (Paperback),/book/show/97412.On_the_Shortness_of_Life,Seneca,4.23,18242,49
Overwhelmed: Work; Love; and Play When No One Has the Time (Hardcover),/book/show/17934399-overwhelmed,Brigid Schulte,3.87,6618,2014
18 Minutes: Find Your Focus; Master Distraction; and Get the Right Things Done (Hardcover),/book/show/12138871-18-minutes,Peter Bregman,3.88,4303,2011
Broken Open: How Difficult Times Can Help Us Grow (Paperback),/book/show/126820.Broken_Open,Elizabeth Lesser,4.08,5384,2004
Reinventing Your Life: The Breakthrough Program to End Negative Behavior...and Feel Great Again (Paperback),/book/show/43866.Reinventing_Your_Life,Jeffrey E. Young,4.2,2699,1993
In the Meantime: Finding Yourself and the Love You Want (Paperback),/book/show/285070.In_the_Meantime,Iyanla Vanzant,4.2,8109,1998
The Nerdist Way: How to Reach the Next Level (In Real Life),/book/show/10723227-the-nerdist-way,Chris Hardwick,3.71,4838,2011
The E-Myth Revisited: Why Most Small Businesses Don't Work and What to Do About It (Paperback),/book/show/81948.The_E_Myth_Revisited,Michael E. Gerber,4.02,61253,1985
Stillness Speaks (Paperback),/book/show/67864.Stillness_Speaks,Eckhart Tolle,4.29,13208,2003
Antifragile: Things That Gain from Disorder (Hardcover),/book/show/13530973-antifragile,Nassim Nicholas Taleb,4.1,34310,2012
Anatomy of the Spirit: The Seven Stages of Power and Healing (Paperback),/book/show/832543.Anatomy_of_the_Spirit,Caroline Myss,4.15,27050,1996
The Fine Art of Small Talk: How to Start a Conversation; Keep It Going; Build Networking Skills and Leave a Positive Impression! (Hardcover),/book/show/93409.The_Fine_Art_of_Small_Talk,Debra Fine,3.44,2977,1997
Six Thinking Hats (Paperback),/book/show/97030.Six_Thinking_Hats,Edward de Bono,3.76,9166,1981
Rejection Proof: How I Beat Fear and Became Invincible Through 100 Days of Rejection (Hardcover),/book/show/22747928-rejection-proof,Jia Jiang,4.14,3753,2015
The 33 Strategies of War (Hardcover),/book/show/35289.The_33_Strategies_of_War,Robert Greene,4.3,10443,2005
Anger: Wisdom for Cooling the Flames (Paperback),/book/show/95734.Anger,Thich Nhat Hanh,4.12,7359,2001
Stop Walking on Eggshells: Taking Your Life Back When Someone You Care about Has Borderline Personality Disorder (Hardcover),/book/show/188013.Stop_Walking_on_Eggshells,Paul T. Mason,4.06,6821,1998
Embrace Your Weird: Face Your Fears and Unleash Creativity (Paperback),/book/show/43822665-embrace-your-weird,Felicia Day,4.02,1438,2019
The Obesity Code: Unlocking the Secrets of Weight Loss (Paperback),/book/show/24945404-the-obesity-code,Jason Fung,4.39,17965,2016
The Rules of Life: A Personal Code for Living a Better; Happier; More Successful Life (Paperback),/book/show/232088.The_Rules_of_Life,Richard Templar,3.74,4271,2005
Stay Sexy & Don\xe2\x80\x99t Get Murdered: The Definitive How-To Guide (Kindle Edition),/book/show/41068144-stay-sexy-don-t-get-murdered,Karen Kilgariff,4.14,46060,2019
Your Best Year Ever: A 5-Step Plan for Achieving Your Most Important Goals (Hardcover),/book/show/35138433-your-best-year-ever,Michael Hyatt,4.01,3567,2018
Recovery: Freedom from Our Addictions (Hardcover),/book/show/33932358-recovery,Russell Brand,4.02,7049,2017
Carry On; Warrior: Thoughts on Life Unarmed (Hardcover),/book/show/15802944-carry-on-warrior,Glennon Doyle Melton,4.16,22690,2013
Solving the Procrastination Puzzle: A Concise Guide to Strategies for Change (Paperback),/book/show/18079767-solving-the-procrastination-puzzle,Timothy A. Pychyl,3.76,2782,2013
Running on Empty: Overcome Your Childhood Emotional Neglect (Paperback),/book/show/15812553-running-on-empty,Jonice Webb,4.22,2835,2012
Start Where You Are: A Guide to Compassionate Living (Paperback),/book/show/815715.Start_Where_You_Are,Pema Ch\xc3\xb6dr\xc3\xb6n,4.3,9670,1994
The Power of Moments: Why Certain Experiences Have Extraordinary Impact (Hardcover),/book/show/34466952-the-power-of-moments,Chip Heath,4.22,9736,2017
MONEY Master the Game: 7 Simple Steps to Financial Freedom (Hardcover),/book/show/23014006-money-master-the-game,Anthony Robbins,3.99,14359,2014
The Book of Awakening: Having the Life You Want by Being Present to the Life You Have (Paperback),/book/show/7581.The_Book_of_Awakening,Mark Nepo,4.26,7271,1999
What Should I Do with My Life?: The True Story of People Who Answered the Ultimate Question (Mass Market Paperback),/book/show/163365.What_Should_I_Do_with_My_Life_,Po Bronson,3.69,7145,2002
Care of the Soul: A Guide for Cultivating Depth and Sacredness in Everyday Life (Paperback),/book/show/295132.Care_of_the_Soul,Thomas  Moore,3.99,15495,1988
The Art of Living: The Classical Manual on Virtue; Happiness and Effectiveness (Paperback),/book/show/24618.The_Art_of_Living,Epictetus,4.24,14291,125
Love and Respect: The Love She Most Desires; The Respect He Desperately Needs (Hardcover),/book/show/56405.Love_and_Respect,Emerson Eggerichs,4.19,44285,2004
Love for Imperfect Things: How to Accept Yourself in a World Striving for Perfection (Hardcover),/book/show/39736045-love-for-imperfect-things,Haemin Sunim,4.25,3751,2016
The Happiness of Pursuit: Finding the Quest That Will Bring Purpose to Your Life (Hardcover),/book/show/20170321-the-happiness-of-pursuit,Chris Guillebeau,3.74,4909,2014
The Five Love Languages for Singles (Paperback),/book/show/615389.The_Five_Love_Languages_for_Singles,Gary Chapman,4.17,8711,2001
The Ethical Slut: A Guide to Infinite Sexual Possibilities (Paperback),/book/show/54944.The_Ethical_Slut,Dossie Easton,3.9,12779,1997
The Elements of Style (Hardcover),/book/show/33514.The_Elements_of_Style,William Strunk Jr.,4.17,73767,1918
The Dance of Connection: How to Talk to Someone When You're Mad; Hurt; Scared; Frustrated; Insulted; Betrayed; or Desperate (Paperback),/book/show/162431.The_Dance_of_Connection,Harriet Lerner,4.04,2254,2001
The 15 Invaluable Laws of Growth: Live Them and Reach Your Potential (Hardcover),/book/show/13529210-the-15-invaluable-laws-of-growth,John C. Maxwell,4.34,5755,2012
100 Ways to Motivate Yourself: Change Your Life Forever (Paperback),/book/show/60311.100_Ways_to_Motivate_Yourself,Steve Chandler,4.07,5801,2006
Living Forward: A Proven Plan to Stop Drifting and Get the Life You Want (Hardcover),/book/show/26266675-living-forward,Michael Hyatt,4.01,3585,2016
Mistakes Were Made (But Not by Me): Why We Justify Foolish Beliefs; Bad Decisions; and Hurtful Acts,/book/show/522525.Mistakes_Were_Made_But_Not_by_Me_,Carol Tavris,4.03,22050,2007
Do What You Are : Discover the Perfect Career for You Through the Secrets of Personality Type (Paperback),/book/show/49051.Do_What_You_Are_,Paul D. Tieger,3.86,4245,1992
The Speed of Trust: The One Thing that Changes Everything (Hardcover),/book/show/36076.The_Speed_of_Trust,Stephen M.R. Covey,4,19538,2006
The Procrastination Equation: How to Stop Putting Things Off and Start Getting Stuff Done (Hardcover),/book/show/9514605-the-procrastination-equation,Piers Steel,3.84,1830,2010
How to Think Like Leonardo da Vinci: Seven Steps to Genius Every Day (Paperback),/book/show/598506.How_to_Think_Like_Leonardo_da_Vinci,Michael J. Gelb,3.87,4568,1998
Be Here Now (Kindle Edition),/book/show/41580312-be-here-now,Ram Dass,4.28,25949,1971
The Present: The Secret to Enjoying Your Work and Life; Now! (Hardcover),/book/show/60283.The_Present,Spencer Johnson,3.94,7336,1981
How to Make People Like You in 90 Seconds or Less (Hardcover),/book/show/181727.How_to_Make_People_Like_You_in_90_Seconds_or_Less,Nicholas Boothman,3.71,5196,1999
Fluent Forever: How to Learn Any Language Fast and Never Forget It (Paperback),/book/show/19661852-fluent-forever,Gabriel Wyner,4.2,6799,2014
The Millionaire Fastlane: Crack the Code to Wealth and Live Rich for a Lifetime! (Paperback),/book/show/18872437-the-millionaire-fastlane,M.J. DeMarco,4.36,9604,2010
Buy Yourself the F*cking Lilies: And Other Rituals to Fix Your Life; from Someone Who's Been There (Hardcover),/book/show/46064076-buy-yourself-the-f-cking-lilies,Tara Schuster,3.96,2436,2020
Minimalism: Live a Meaningful Life (Kindle Edition),/book/show/13185350-minimalism,Joshua Fields Millburn,3.7,7435,2011
Modern Romance (Hardcover),/book/show/23453112-modern-romance,Aziz Ansari,3.82,164030,2015
E-Squared: Nine Do-It-Yourself Energy Experiments That Prove Your Thoughts Create Your Reality (Paperback),/book/show/15814383-e-squared,Pam Grout,3.93,8034,2013
Unshakeable: Your Financial Freedom Playbook (Kindle Edition),/book/show/40885164-unshakeable,Anthony Robbins,4.11,9659,2017
You Need a Budget: The Proven System for Breaking the Paycheck to Paycheck Cycle; Getting Out of Debt; and Living the Life You Want (Hardcover),/book/show/34950841-you-need-a-budget,Jesse Mecham,4.1,5015,2010
Mindfulness for Beginners (ebook),/book/show/14098.Mindfulness_for_Beginners,Jon Kabat-Zinn,3.79,4991,2006
Bored and Brilliant: How Spacing Out Can Unlock Your Most Productive & Creative Self (Hardcover),/book/show/33574185-bored-and-brilliant,Manoush Zomorodi,3.73,3224,2017
The Game of Life and How to Play It (Paperback),/book/show/626159.The_Game_of_Life_and_How_to_Play_It,Florence Scovel Shinn,4.13,7057,1978
Thanks for the Feedback: The Science and Art of Receiving Feedback Well (Hardcover),/book/show/18114120-thanks-for-the-feedback,Douglas Stone,4.11,4070,2014
Change Anything: The New Science of Personal Success (Hardcover),/book/show/9745641-change-anything,Kerry Patterson,3.99,3072,2011
Light is the New Black: A Guide to Answering Your Soul's Callings and Working Your Light (Paperback),/book/show/23280915-light-is-the-new-black,Rebecca   Campbell,4.03,4015,2015
The Personal MBA: Master the Art of Business (Hardcover),/book/show/9512985-the-personal-mba,Josh Kaufman,4.08,28190,2010
Mindless Eating: Why We Eat More Than We Think (Hardcover),/book/show/129731.Mindless_Eating,Brian Wansink,3.95,10686,2006
The Master Key System (Paperback),/book/show/71316.The_Master_Key_System,Charles F. Haanel,4.21,5225,1912
The Upward Spiral: Using Neuroscience to Reverse the Course of Depression; One Small Change at a Time (Paperback),/book/show/21413760-the-upward-spiral,Alex Korb,4.26,2686,2015
The Motivation Manifesto (Hardcover),/book/show/22891629-the-motivation-manifesto,Brendon Burchard,4.14,3761,2014
Freakonomics: A Rogue Economist Explores the Hidden Side of Everything (Hardcover),/book/show/1202.Freakonomics,Steven D. Levitt,3.98,702921,2005
Social Intelligence: The New Science of Human Relationships (Hardcover),/book/show/26324.Social_Intelligence,Daniel Goleman,3.99,11796,2006
White Fragility: Why It\xe2\x80\x99s So Hard for White People to Talk About Racism (Paperback),/book/show/43708708-white-fragility,Robin DiAngelo,4.32,87680,2018
Gift from the Sea (Paperback),/book/show/77295.Gift_from_the_Sea,Anne Morrow Lindbergh,4.16,42291,1955
May Cause Miracles: A 40-Day Guidebook of Subtle Shifts for Radical Change and Unlimited Happiness (Hardcover),/book/show/13573425-may-cause-miracles,Gabrielle Bernstein,3.85,3685,2012
Financial Peace Revisited (Hardcover),/book/show/129565.Financial_Peace_Revisited,Dave Ramsey,4.3,13300,1992
Self-Esteem: A proven program of cognitive techniques for assessing; improving and maintaining your self-esteem (Paperback),/book/show/839461.Self_Esteem,Matthew McKay,4.02,1143,1987
Chicken Soup for the Teenage Soul (Paperback),/book/show/427920.Chicken_Soup_for_the_Teenage_Soul,Jack Canfield,3.93,17571,1997
Sink Reflections (Paperback),/book/show/350258.Sink_Reflections,Marla Cilley,4.05,4691,2002
The Power of Meaning: Crafting a Life That Matters (Hardcover),/book/show/30008950-the-power-of-meaning,Emily Esfahani Smith,4.02,2838,2017
The Empath's Survival Guide: Life Strategies for Sensitive People (Hardcover),/book/show/30962218-the-empath-s-survival-guide,Judith Orloff,3.85,3225,2017
